question,answer,contexts,ground_truth,id,equipo,answer_relevancy,context_relevancy,context_recall,answer_similarity,answer_correctness,precision_bertscore,recall_bertscore,f1_bertscore,mismo_producto,especificaciones_correctas,especificaciones_correctas_norm,contexts_long
"Las especificaciones mínimas de las cámaras serán: [LISTA] Las cámaras deberán permitir la captura de la matrícula trasera de los vehículos, así como una imagen de contexto a color para captar la evidencia del lugar. Se valorará que la capturas se realicen por sensores que estén integrados en una misma carcasa. [LISTA] Resolución mínima de 5 Mpx para la captura de las matrículas y 2.3 Mpx para contexto. [LISTA] La captura de matrícula tendrá una fiabilidad certificada por laboratorio acreditado de: o Fiabilidad de detección mayor o igual al 98% (matriculas detectadas del total de tránsitos). En caso de que se deseen considerar ciclomotores esta fiabilidad será mayor o igual al 97%. [SUBLISTA] Fiabilidad de reconocimiento mayor o igual al 97% (matrículas correctas del total de matrículas detectadas). En caso de que se deseen considerar ciclomotores esta fiabilidad será mayor o igual al 95%. [LISTA] Deberá reconocer la lectura de matrículas de los países de la UE e internacionales de países fronterizos con la misma, sin necesidad de implementar OCR adicionales y sin necesidad de nuevas licencias. [LISTA] Deberá estar dotada de un procesador interno para el reconocimiento de matrículas y la capacidad de almacenamiento necesario para el caso de pérdidas de comunicaciones para almacenar al menos 200.000 imágenes. [LISTA] Deberá disponer de un sistema de sincronización horaria. [LISTA] No debe requerir de sensores externos para detectar el paso de los vehículos. [LISTA] Capacidad de lectura de mínimo dos carriles. [LISTA] Deberá incluir un sistema de iluminación infrarroja para garantizar las fiabilidades en horario nocturno. [LISTA] La cámara debe detectar matriculas entre 0 y 200 Km/h de velocidad. [LISTA] Debe poder manejar listas y disponer de reglas de comportamiento, con actualización remota desde la Plataforma ZBE para la detección de posibles infractores. Se valorará la implementación de soluciones que permitan el cumplimiento de la LOPD. [LISTA] En el caso de posible infracción generará un fichero que incluirá al menos: o La fecha y hora de la captura sincronizados con el Centro de Control. [SUBLISTA] Localización del punto de control. [SUBLISTA] Matrícula capturada. [SUBLISTA] Código de control para verificar que los ficheros no han sido modificados. [LISTA] Las imágenes podrán ser enviadas junto con el fichero o enviadas posteriormente bajo petición del Centro de Control. [LISTA] El sistema además deberá proporcionar información de aforo sobre todos los vehículos que circulen por el punto de control: o Detección de marca y color de vehículos o Clasificación de vehículos o Estimación de la velocidad puntual de vehículos [LISTA] Enviará la información encriptada al Centro de Control. [LISTA] Deberá proporcionar flujo de video de la imagen de contexto para su visualización y grabación desde el Centro de Control con codificación H264 o H265, al menos 25 fps y protocolo ONVIF. [LISTA] Gestión remota del equipo vía web: Configuración del sistema y visualización de imágenes y detecciones a tiempo real. [LISTA] Carcasa con certificado mínimo IP67 e IK10. [LISTA] Puerto de conexión Gigabit Ethernet 10/100/1000 [LISTA] Temperatura operacional -20ºC a +55ºC. [LISTA] Humedad relativa 90%. [LISTA] Deberá cumplir con las normas: o UNE 199141.1-2013 o UNE 199141.2-2013 o UNE 199142-1-2015 [LISTA] Se valorará la certificación de: o UNE 199142-3. Detección de vehículos infractores. Parte 3: Especificación funcional y protocolos para el control en las Zonas de Bajas Emisiones y UVAR o Guía WELMEC 7.2.2019","- Nombre del equipo y proveedor: NL Ghost AI, Neural Labs.
- Especificaciones que se han preguntado y aparecen en el contexto:
  - Resolución mínima de 5 Mpx para la captura de las matrículas y 2.3 Mpx para contexto.
  - Fiabilidad de detección mayor o igual al 98% (matriculas detectadas del total de tránsitos).
  - Fiabilidad de reconocimiento mayor o igual al 97% (matrículas correctas del total de matrículas detectadas).
  - Reconocimiento de matrículas de los países de la UE e internacionales de países fronterizos sin necesidad de implementar OCR adicionales y sin necesidad de nuevas licencias.
  - Procesador interno para el reconocimiento de matrículas y capacidad de almacenamiento para al menos 200.000 imágenes.
  - Sistema de sincronización horaria.
  - No requiere de sensores externos para detectar el paso de los vehículos.
  - Capacidad de lectura de mínimo dos carriles.
  - Sistema de iluminación infrarroja para garantizar las fiabilidades en horario nocturno.
  - Detecta matrículas entre 0 y 200 Km/h de velocidad.
  - Maneja listas y dispone de reglas de comportamiento, con actualización remota desde la Plataforma ZBE.
  - Genera un fichero en caso de posible infracción que incluye fecha y hora de la captura sincronizados con el Centro de Control, localización del punto de control, matrícula capturada y código de control para verificar que los ficheros no han sido modificados.
  - Imágenes pueden ser enviadas junto con el fichero o enviadas posteriormente bajo petición del Centro de Control.
  - Proporciona información de aforo sobre todos los vehículos que circulen por el punto de control: detección de marca y color de vehículos, clasificación de vehículos, estimación de la velocidad puntual de vehículos.
  - Envío de información encriptada al Centro de Control.
  - Proporciona flujo de video de la imagen de contexto para su visualización y grabación desde el Centro de Control con codificación H264 o H265, al menos 25 fps y protocolo ONVIF.
  - Gestión remota del equipo vía web: configuración del sistema y visualización de imágenes y detecciones a tiempo real.
  - Carcasa con certificado mínimo IP67 e IK10.
  - Puerto de conexión Gigabit Ethernet 10/100/1000.
  - Temperatura operacional -20ºC a +55ºC.
  - Humedad relativa 90%.
  - Cumple con las normas: UNE 199141.1-2013, UNE 199141.2-2013, UNE 199142-1-2015.
  - Certificación de UNE 199142-3 y Guía WELMEC 7.2.2019 valorada.","['La cámara LPR y la cámara de entorno pueden detectar matrículas de más de 70 países. Para la cámara LPR, hay tres opciones de sensores: Opción 1: 3.2MP 1/1.8” mono Global Shutter CMOS IMX265 con lentes de 11-50mm o 5.2-58.8mm (con zoom, foco y control del iris motorizados). Opción 2: 5MP 2/3’’ mono', 'Vehículos transitando en contrasentido. [LISTA] Vehículos estacionados en zonas prohibidas. [LISTA] Vehículos que no respectan la señal de STOP. [LISTA] Y más. Toda infracción detectada se registra junto a vídeos de la cámara de entorno que muestran evidencia de la infracción. La metadata es', 'Seguridad EN IEC 62368-1 IEC 62368-1 UL62368-1 IEC 62471 EN/IEC/UL 60950-22 Índice de protección frente a entrada EN 60529 (IP66) Rendimiento de imágenes IEC 62676-5 Representación de colores ITU-R BT.709-6 Cumplimiento de la normativa ONVIF EN 50132-5-2, EN 62676-2 Iluminación por infrarrojos IEC', 'Capta fotografías de alta resolución a 150 metros de distancia. [LISTA] Registra matrículas de moticicletas. [LISTA] Captación entre sanciones rápida. Detecta hasta Control remoto mediante PC para visualizar capturas y descargar infracciones en aproximación y alejamiento Especificaciones Alta', 'listas. [LISTA] Gestionar operadores. [LISTA] Monitorizar estado de los equipos NL-GHOST. ESPECIFICACIONES TÉCNICAS Equipo dual Cámara LPR y cámara de entorno en la misma carcasa Analíticas Reconocimiento de matrículas, clasificación, marca, color, velocidad, carril, país y sentido de circulación', 'para fines estadísticos la velocidad de los vehículos y detectar marca, color, velocidad y clasificación del vehículo: automóvil, motocicleta, bus, camión y furgoneta (Van o SUV), carril y sentido de cada vehículo detectado. Además, soporta matrículas de múltiples países al mismo tiempo. *Según', '[TABLA] El modelo Trucam II de Tradegesur es un cinemómetro sancionador con las siguientes especificaciones técnicas: Tiene un sistema de lentes I con un sensor de imágenes de 5.0 Mpx (2592 x 1944) y una longitud focal de 330 mm. El enfoque es automático y se basa en la distancia al objeto, con un', '[TABLA] El modelo de cámara DS-TCG406-E de HikVision cuenta con protección IK10 (IEC 62262: 2002) y IP67 (IEC 60529-2013). En cuanto a la funcionalidad inteligente, presenta una tasa de captura superior al 98%, reconocimiento de la dirección de movimiento del vehículo con una precisión mayor al']","NL GHOST AI procesa analíticas de vídeo aplicadas a vehículos como LPR (lectura de matrículas/placas). Incluye una cámara CMOS ultrasensible que puede ser de 3.2, 5 o 8.9 MP para lectura de matrículas y otra cámara a color CMOS de hasta 5MP para registro de evidencias. No se dice nada sobre la fiabilidad del laboratorio. Reconoce matrículas de más de 70 países. Tiene un almacenamiento de 64GB eMMC5.1 Flash para el sistema operativa, soldada a bordo con un 256GB M.2 SSD (y ampliable hasta 2 TB). Tiene sincronización NTP/STNP o GPS. No requiere de sensores externos. Lee múltiples matrículas en hasta 2 carriles. Tiene iluminación infrarroja estroboscópica con 13 LEDS NIR a 850 nm. Detecta matrículas hasta 250 km/h. Los metadatos son accesibles a través de SDK para integración con sistemas de terceros o también se integra a la suite NEURAL SERVER para gestión de las propuestas de sanción. No se comenta si cumple con la LODP (Ley Orgánica de Defensa del Pueblo). No se habla sobre el fichero que se generará por infracción ni de la imagen infractora. El sistema detecta la marca, el color, la velocidad y la clasificación del vehículo y puede mandar la información encriptada. La codificación del video puede ser H.264 4K@55fps, H.265 4K@64fps. No sabemos si permite gestión remota. Carcasa con protección IP67 e IK10. Puerto de red Giga Ethernet con controlador. Rango operativo de temperatura desde -40ºC a +85ºC. No se comenta nada de la humedad relativa. No sabemos si cumple con las normas UNE. ",Neural_Labs-16-camara,camara,,0.0,,0.9346559173504828,0.6218992734552677,0.7122869491577148,0.6833231449127197,0.6975045204162598,1,4,0.25,"[Document(page_content='La cámara LPR y la cámara de entorno pueden detectar matrículas de más de 70 países. Para la cámara LPR, hay tres opciones de sensores: Opción 1: 3.2MP 1/1.8” mono Global Shutter CMOS IMX265 con lentes de 11-50mm o 5.2-58.8mm (con zoom, foco y control del iris motorizados). Opción 2: 5MP 2/3’’ mono', metadata={'nombre_pdf': 'neurallabs-NL-GHOST-AI-ES-2024', 'modelo': 'NL Ghost AI', 'proveedor': 'Neural Labs', 'equipo': 'camara', 'tabla': True}), Document(page_content='Vehículos transitando en contrasentido. [LISTA] Vehículos estacionados en zonas prohibidas. [LISTA] Vehículos que no respectan la señal de STOP. [LISTA] Y más. Toda infracción detectada se registra junto a vídeos de la cámara de entorno que muestran evidencia de la infracción. La metadata es', metadata={'nombre_pdf': 'neurallabs-NL-GHOST-AI-ES-2024', 'modelo': 'NL Ghost AI', 'proveedor': 'Neural Labs', 'equipo': 'camara'}), Document(page_content='Seguridad EN IEC 62368-1 IEC 62368-1 UL62368-1 IEC 62471 EN/IEC/UL 60950-22 Índice de protección frente a entrada EN 60529 (IP66) Rendimiento de imágenes IEC 62676-5 Representación de colores ITU-R BT.709-6 Cumplimiento de la normativa ONVIF EN 50132-5-2, EN 62676-2 Iluminación por infrarrojos IEC', metadata={'nombre_pdf': 'bosch-FLEXIDOME_outdoor_31_Data_sheet_esES_121019031947', 'modelo': 'FLEXIDOME outdoor 3100i IR', 'proveedor': 'Bosch', 'equipo': 'camara'}), Document(page_content='Capta fotografías de alta resolución a 150 metros de distancia. [LISTA] Registra matrículas de moticicletas. [LISTA] Captación entre sanciones rápida. Detecta hasta Control remoto mediante PC para visualizar capturas y descargar infracciones en aproximación y alejamiento Especificaciones Alta', metadata={'nombre_pdf': 'tradesegur-TruCAMII_v5', 'modelo': 'Trucam II', 'proveedor': 'Tradegesur', 'equipo': 'cinemometro sancionador'}), Document(page_content='listas. [LISTA] Gestionar operadores. [LISTA] Monitorizar estado de los equipos NL-GHOST. ESPECIFICACIONES TÉCNICAS Equipo dual Cámara LPR y cámara de entorno en la misma carcasa Analíticas Reconocimiento de matrículas, clasificación, marca, color, velocidad, carril, país y sentido de circulación', metadata={'nombre_pdf': 'neurallabs-NL-GHOST-AI-ES-2024', 'modelo': 'NL Ghost AI', 'proveedor': 'Neural Labs', 'equipo': 'camara'}), Document(page_content='para fines estadísticos la velocidad de los vehículos y detectar marca, color, velocidad y clasificación del vehículo: automóvil, motocicleta, bus, camión y furgoneta (Van o SUV), carril y sentido de cada vehículo detectado. Además, soporta matrículas de múltiples países al mismo tiempo. *Según', metadata={'nombre_pdf': 'neurallabs-NL-GHOST-AI-ES-2024', 'modelo': 'NL Ghost AI', 'proveedor': 'Neural Labs', 'equipo': 'camara'}), Document(page_content='[TABLA] El modelo Trucam II de Tradegesur es un cinemómetro sancionador con las siguientes especificaciones técnicas: Tiene un sistema de lentes I con un sensor de imágenes de 5.0 Mpx (2592 x 1944) y una longitud focal de 330 mm. El enfoque es automático y se basa en la distancia al objeto, con un', metadata={'nombre_pdf': 'tradesegur-TruCAMII_v5', 'modelo': 'Trucam II', 'proveedor': 'Tradegesur', 'equipo': 'cinemometro sancionador', 'tabla': True}), Document(page_content='[TABLA] El modelo de cámara DS-TCG406-E de HikVision cuenta con protección IK10 (IEC 62262: 2002) y IP67 (IEC 60529-2013). En cuanto a la funcionalidad inteligente, presenta una tasa de captura superior al 98%, reconocimiento de la dirección de movimiento del vehículo con una precisión mayor al', metadata={'nombre_pdf': 'hikvision-DS-TCG406-E_Datasheet_20230704', 'modelo': 'DS-TCG406-E', 'proveedor': 'HikVision', 'equipo': 'camara', 'tabla': True})]"
"Las especificaciones mínimas de las cámaras PTZ serán las siguientes: [LISTA] CMOS con escaneo progresivo. [LISTA] Resolución 2 Mpx @25fps. [LISTA] Iluminación mínima 0.005 Lux y 0 Lux con IR encendido. [LISTA] Filtro IR cut día/noche. [LISTA] Iluminador infrarrojo con rango IR 150m. [LISTA] Rango dinámico extendido 120dB. [LISTA] Zoom óptico x25, zoom digital x16. [LISTA] Pan 360º. [LISTA] Tilt -0º a 90º [LISTA] 200 presets. [LISTA] 3 flujos de vídeo. [LISTA] Compresión MJPEG, H.264, H.265. [LISTA] Protocolos: IPv4/IPv6, HTTP, HTTPS, 802.1x, Qos, FTP, SMTP, UPnP, SNMP, DNS, DDNS, NTP, RTSP, RTCP, RTP, TCP/IP, DHCP, PPPoE, UDP, IGMP, ICMP, [LISTA] Cumplimiento perfiles ONVIF S, ONVIF G y ONVIF T. [LISTA] Seguridad: protección con contraseña, HTTPS, autentificación 802.1X RTP/RTSP sobre HTTPS. [LISTA] Configuración De Imagen: saturación, brillo, contraste, balance de blancos, control automático de la ganancia y nitidez. [LISTA] Máscara De Privacidad: Hasta 24 mascaras [LISTA] Interfaz Ethernet: 1 RJ45 10 M/100 PoE. [LISTA] Detección de eventos: Detección de movimiento, detección de cruce de línea y detección de movimiento de objeto. [LISTA] Alimentación VDC o PoE: 802.3at. [LISTA] Consumo máximo 45W. [LISTA] Almacenamiento en interno hasta 128Gb [LISTA] Temperatura operacional -40ºC a 70ºC. [LISTA] Humedad relativa de funcionamiento hasta 95%. [LISTA] Grado de protección IP 67. [LISTA] Grado de protección contra impactos IK10.","- Nombre del equipo y proveedor: H5A PTZ Resistente, Avigilon.
- Especificaciones que se han preguntado y aparecen en el contexto:
  - Temperatura operacional: -40ºC a 65ºC.
  - Humedad relativa de funcionamiento: No lo sé.
  - Grado de protección: IK10.
  - Grado de protección contra impactos: No lo sé.","['IK10, IP66, 2 50 m IR 1 45 250 m (820 pies) Sí Sí Sí 2.0C-H4IRPTZ-DP30 PTZ IR H4 de 2 MP, 30X, análisis de autoaprendizaje, IK10, IP66, IR de 250 m 2 30 250 m (820 pies) Sí Sí Sí 1.0C-H4IRPTZ-DP45-WP PTZ IR H4 de 1 MP con limpiador 45X, análisis de autoaprendizaje, IK10, IP66, IR de 250 m 1 45 250', 'si el PTZ se mueve a máxima velocidad. FIABILIDAD OPERATIVA PARA SUPERVISAR ELTRÁFICO Cumple con los requisitos ambientales NEMA TS2 para implementación en aplicaciones de monitoreo de tráfico. INSTALACIÓN FLEXIBLE Ofrece muchas opciones de accesorios que le permiten adaptarse a las instalaciones', '[TABLA] La cámara modelo H5A PTZ Resistente de Avigilon tiene las siguientes especificaciones técnicas: La temperatura de funcionamiento en operación continua varía de -40 °C a +65 °C (-40 °F a 149 °F). La temperatura de almacenamiento va de -40 °C a +70 °C (-40 °F a 158 °F). La humedad soportada es', 'ad ONVIF ProfileS; ONVIF Profile G; GB/T 28181 Especificaciones mecánicas Ajuste de 3 ejes (giro/ inclinación/ rotación) 360º / 90º / 360º Dimensiones (Al.xAn.xPr.) 271mmx90mmx90mm (10,7x3,5x3,5pulg.) sin SMB Peso de la cámara sin SMB 1,3kg (2,9libras) Peso de la SMB 0,67kg (1,48libras) Color', 'delanteras y traseras para mejorar la precisión LPR. \uf06e Especificación Cámara Máx. Resolución 2688 × 1520 Tipo de sensor CMOS de escaneo progresivo de 1/1,8"" Iluminación mínima Color: 0,0005 Lux a (F1.2, AGC ON) B/N: 0,0001 Lux a (F1.2, AGC ON) 0 Lux con obturador IR 1/30 s a 1/100 000 s Conmutador', 'de cámara/lente puede cumplir estos criterios: Cámara de 5MP con lente de 3,2mm - 10,5mm* DORI Definición de DORI Distancia 10,5mm/3,2m m Anchura horizontal Detección 25px/m (8px/pie) 48m/200m (147 pies/656 pies) 104m (341pies) Observación 63px/m (19px/pie) 19m/79m (62 pies/259 pies) 41m (135pies)', '2 MP 4MP 8 MP CARACTERÍSTICAS RESISTENCIA Y DURACIÓN EXCEPCIONALES Probado según MIL-STD-167-1A y 810G para tolerancia extrema a golpes y vibraciones. Clasificación IK10 de resistencia a impactos ALTA RESISTENCIA AL VIENTO Resiste vientos de hasta 230 kph (143 mph) si el PTZ se mueve a máxima', 'Objetivo De 4,25 a 170mm, F/1,6 - F/4,95, enfoque automático De 4,4 a 88mm, F/2,0 - F/3,8, enfoque automático Ángulo de visión Horizontal 66,35° - 1,9° 69,7° - 2,2° Segmento vertical 38,5° - 1,1° 42,8° - 1,3° Zoom 40x 36x1 CONTROL DE IMAGEN 2,0 MP 4,0MP 8MP Compresión de video H.264 HDSM']","Cámara 2.0C-H4IRPTZ-DP30-WP del fabricante Avigilon. Tiene CMOS con escaneo progresivo WDR 1/2.8”. Resolución 2 MPx. Iluminación mínima de 0 lux en modo IR; 0,1 lux (F/1,6) en modo color (sin IR); 0,03 lux (F/1,6) en modo monocromo (sin IR). Control filtro día/noche automático o manual. Tiene iluminación IR con rango máximo de 250m a 0 lux. Rango dinámico 120+ dB. Zoom óptico x30 y zoom digital x100. Pan de 360º con 300º/segundo. Tilt de -20º a 90º, con auto-flip y 300º/segundo. Hasta 500 presets con nombre. Tiene multistream H.264 y Motion JPEG. Compresión H.264 (MPEG-4 Part 10/AVC), Motion JPEG, HDSM SmartCodec technology. Tiene protocolos: IPv6, IPv4, HTTP, HTTPS, SOAP, DNS, NTP, RTSP, RTCP, RTP, TCP, UDP, IGMP, ICMP, DHCP, Zeroconf, ARP, LLDP, HSTS. Versiones de ONVIF 1.02, 2.00, Profile S, Profile T, Profile G. Seguridad de Protección por contraseña, cifrado HTTPS, autenticación digest, autenticación WS, registro de acceso de usuarios, autenticación basada en puertos 802.1x. Incluye configuración de la saturación, brillo, contraste, balance de blancos, control de la ganancia y nitidez de la imagen automático y manual. Hasta 64 máscaras de privacidad con soporte de máscara 3D. No habla sobre la interfaz de ethernet. Detección de movimiento, de cruce de línea y de movimiento del objeto. Alimentación 24 VDC. El consumo máximo es 75 W. Almacenamiento interno para ranura microSD/microSDHC/microSDXC. Temperatura operacional de -40ºC a +60ºC. Humedad de funcionamiento de 0 a 95% sin condensar. Grado de protección IP 66. Protección ambiental IK 10 contra impactos. ",Avigilon-20-camara,camara,,0.0,,0.8937747657174414,0.3143527823384512,0.6424254775047302,0.5169117450714111,0.5728743076324463,0,2,0.08,"[Document(page_content='IK10, IP66, 2 50 m IR 1 45 250 m (820 pies) Sí Sí Sí 2.0C-H4IRPTZ-DP30 PTZ IR H4 de 2 MP, 30X, análisis de autoaprendizaje, IK10, IP66, IR de 250 m 2 30 250 m (820 pies) Sí Sí Sí 1.0C-H4IRPTZ-DP45-WP PTZ IR H4 de 1 MP con limpiador 45X, análisis de autoaprendizaje, IK10, IP66, IR de 250 m 1 45 250', metadata={'nombre_pdf': 'avigilon-h4-ir-ptz-datasheet-en-rev9', 'modelo': '2.0C-H4IRPTZ-DP30-WP', 'proveedor': 'Avigilon', 'equipo': 'camara'}), Document(page_content='si el PTZ se mueve a máxima velocidad. FIABILIDAD OPERATIVA PARA SUPERVISAR ELTRÁFICO Cumple con los requisitos ambientales NEMA TS2 para implementación en aplicaciones de monitoreo de tráfico. INSTALACIÓN FLEXIBLE Ofrece muchas opciones de accesorios que le permiten adaptarse a las instalaciones', metadata={'nombre_pdf': 'avigilon-h5a-rugged-ptz-camera-datasheet-es', 'modelo': 'H5A PTZ Resistente', 'proveedor': 'Avigilon', 'equipo': 'camara'}), Document(page_content='[TABLA] La cámara modelo H5A PTZ Resistente de Avigilon tiene las siguientes especificaciones técnicas: La temperatura de funcionamiento en operación continua varía de -40 °C a +65 °C (-40 °F a 149 °F). La temperatura de almacenamiento va de -40 °C a +70 °C (-40 °F a 158 °F). La humedad soportada es', metadata={'nombre_pdf': 'avigilon-h5a-rugged-ptz-camera-datasheet-es', 'modelo': 'H5A PTZ Resistente', 'proveedor': 'Avigilon', 'equipo': 'camara', 'tabla': True}), Document(page_content='ad ONVIF ProfileS; ONVIF Profile G; GB/T 28181 Especificaciones mecánicas Ajuste de 3 ejes (giro/ inclinación/ rotación) 360º / 90º / 360º Dimensiones (Al.xAn.xPr.) 271mmx90mmx90mm (10,7x3,5x3,5pulg.) sin SMB Peso de la cámara sin SMB 1,3kg (2,9libras) Peso de la SMB 0,67kg (1,48libras) Color', metadata={'nombre_pdf': 'bosch-DINION_IP_6000i_Data_sheet_esES_33404347915', 'modelo': 'NBE-6502-AL Bullet DINION IP starlight 6000i IR', 'proveedor': 'Bosch', 'equipo': 'camara'}), Document(page_content='delanteras y traseras para mejorar la precisión LPR. \uf06e Especificación Cámara Máx. Resolución 2688 × 1520 Tipo de sensor CMOS de escaneo progresivo de 1/1,8"" Iluminación mínima Color: 0,0005 Lux a (F1.2, AGC ON) B/N: 0,0001 Lux a (F1.2, AGC ON) 0 Lux con obturador IR 1/30 s a 1/100 000 s Conmutador', metadata={'nombre_pdf': 'hikvision-DS-TCG406-E_Datasheet_20230704', 'modelo': 'DS-TCG406-E', 'proveedor': 'HikVision', 'equipo': 'camara'}), Document(page_content='de cámara/lente puede cumplir estos criterios: Cámara de 5MP con lente de 3,2mm - 10,5mm* DORI Definición de DORI Distancia 10,5mm/3,2m m Anchura horizontal Detección 25px/m (8px/pie) 48m/200m (147 pies/656 pies) 104m (341pies) Observación 63px/m (19px/pie) 19m/79m (62 pies/259 pies) 41m (135pies)', metadata={'nombre_pdf': 'bosch-NDE_5703_AL_Data_sheet_esES_98577430411', 'modelo': 'FLEXIDOME outdoor 5100i IR (NDE-5703-AL)', 'proveedor': 'Bosch', 'equipo': 'camara'}), Document(page_content='2 MP 4MP 8 MP CARACTERÍSTICAS RESISTENCIA Y DURACIÓN EXCEPCIONALES Probado según MIL-STD-167-1A y 810G para tolerancia extrema a golpes y vibraciones. Clasificación IK10 de resistencia a impactos ALTA RESISTENCIA AL VIENTO Resiste vientos de hasta 230 kph (143 mph) si el PTZ se mueve a máxima', metadata={'nombre_pdf': 'avigilon-h5a-rugged-ptz-camera-datasheet-es', 'modelo': 'H5A PTZ Resistente', 'proveedor': 'Avigilon', 'equipo': 'camara'}), Document(page_content='Objetivo De 4,25 a 170mm, F/1,6 - F/4,95, enfoque automático De 4,4 a 88mm, F/2,0 - F/3,8, enfoque automático Ángulo de visión Horizontal 66,35° - 1,9° 69,7° - 2,2° Segmento vertical 38,5° - 1,1° 42,8° - 1,3° Zoom 40x 36x1 CONTROL DE IMAGEN 2,0 MP 4,0MP 8MP Compresión de video H.264 HDSM', metadata={'nombre_pdf': 'avigilon-h5a-rugged-ptz-camera-datasheet-es', 'modelo': 'H5A PTZ Resistente', 'proveedor': 'Avigilon', 'equipo': 'camara'})]"
"Los sonómetros deberán satisfacer las siguientes normas de obligado cumplimiento: [LISTA] Respecto al sensor: o Electroacústica. Sonómetros. Parte 1: Especificaciones. - IEC 61672-1:2002-05, Clase 1, Grupo X/Z - IEC 61672-1:2013, Clase 1, Grupo X/Z. [SUBLISTA] Sonómetros: requisitos adicionales para tareas de medición especiales - DIN 45657:1997-07 - DIN 45657:2014-07 o Niveles de medición de ruido. - IEC 60651:1979 (más la Modificación 1 (1993-02) y la Modificación 2 (2000-10)), Tipo 1, Grupo X/Z o Sonómetros integradores-promediadores. - IEC 60804:2000-10, Tipo 1, Grupo X/Z o Instituto Americano de Estándares Nacionales. Medidores de nivel de sonido. - ANSI S1.4-1983 (más ANSI S1.4A-1985 Modificación), Tipo 1 - ANSI/ASA S1.4 Parte 1-2014, Clase 1, Grupo X/Z - ANSI S1.43-1997, Tipo 1 [LISTA] Respecto a la capacidad de análisis de frecuencia: o Electroacústica. Filtros de banda de octava y de bandas de una fracción de octava. - IEC 61260:1995-07 (más Modificación 1 (2001-09)), Bandas de 1/1 octava y de 1/3 octava, Clase 0, Grupo X/Z, todos los filtros - IEC 61260-1:2014, Bandas de 1/1 octava y de 1/3 octava, Clase 1, Grupo X/Z, todos los filtros o Instituto Americano de Estándares Nacionales. Especificación para octava, media octava y conjuntos de filtros de banda de tercio de octava. - ANSI S1.11-2004, Bandas de 1/1 octava y de 1/3 octava, Clase 0, Grupo X/Z, todos los filtros - ANSI/ASA S1.11-2014/Parte 1, Bandas de 1/1 octava y de 1/3 octava, Clase 1, Grupo X/Z, todos los filtros. [LISTA] Los equipos de monitorizado deberán cumplir, al menos, los siguientes requisitos mínimos: o Dimensiones máximas de 450 x 350 x 250 mm. [SUBLISTA] Suministrarse provistos de todos los accesorios necesarios para su correcta utilización en el momento de su entrega (baterías recargables, funda protectora, pantalla antiviento, manual de instrucciones en castellano, etc.). [SUBLISTA] Equipo de precisión Tipo 1/Clase 1, según norma UNE-EN 61672-1:2014. [SUBLISTA] Equipo de intemperie con protección exterior mínimo IP55 (se entiende cumplido este requisito con el equipo de monitorización instalado, conectado y en funcionamiento). [SUBLISTA] Rango de temperaturas de trabajo desde -10 hasta +50 ºC. [SUBLISTA] Rango dinámico lineal de 96 dB. [SUBLISTA] Rango dinámico de 106 dB. [SUBLISTA] Capacidad de presentar, de forma simultánea, los datos en ponderaciones en frecuencia A y C. [SUBLISTA] Tener la capacidad de realizar análisis en frecuencia en octavas y tercios de octava, desde 20 Hz a 20 KHz. [SUBLISTA] Grado de precisión del análisis espectral conforme a lo establecido en el Real Decreto 1367/2007, de 19 de octubre. [SUBLISTA] Rango dinámico del análisis espectral superior a 96 dB. [SUBLISTA] Transferencia de datos en tiempo real sobre comunicación UMTS/4G. [SUBLISTA] Alimentación a 230 VAC/50 Hz. Los equipos también dispondrán de batería(s) interna(s) con capacidad para alimentar al equipo a pleno funcionamiento durante al menos 48 horas en caso de caída de la alimentación principal.","- Nombre del equipo y proveedor: B&K 2245, HBK.
  - Especificaciones que se han preguntado y aparecen en el contexto:
    - IEC 61672-1:2013, Clase 1, Grupo X/Z.
    - DIN 45657:1997-07.
    - DIN 45657:2014-07.
    - ANSI S1.4-1983 más ANSI S1.4A-1985 Modificación, Tipo 1.
    - ANSI/ASA S1.4 Parte 1-2014, Clase 1, Grupo X/Z.
    - ANSI S1.43-1997, Tipo 1.
    - IEC 61260-1:2014, Bandas de 1/1 octava y de 1/3 octava, Clase 1, Grupo X/Z, todos los filtros.
    - ANSI/ASA S1.11-2014/Parte 1, Bandas de 1/1 octava y de 1/3 octava, Clase 1, Grupo X/Z, todos los filtros.
    - Protección IP65.
    - Rango de temperaturas de trabajo desde -10 hasta +50 ºC.

- Nombre del equipo y proveedor: Clase 1 modelo TA120, CESVA.
  - Especificaciones que se han preguntado y aparecen en el contexto:
    - IEC 61672-1:2013, Clase 1, Grupo X/Z.
    - Protección IP65.","['[TABLA] El modelo de sonómetro B&K 2245 del proveedor HBK cumple con varias normativas y estándares técnicos: [LISTA] Seguridad eléctrica: Cumple con la Radio Equipment Directive 2014/53/EU, RCM, China RoHS, WEEE y FCC. Normas específicas incluyen EN/IEC 61010-1, ANSI/UL 61010-1 y CSA C22.2', '[LISTA] Sensor con precisión clase 1 según IEC 61672-1. [LISTA] Protección contra agentes externos con kit de exterior: viento, lluvia, pájaros. Mantiene clase 1. Protección IP65. [LISTA] Completamente integrable en diferentes plataformas: Noise- Platform (CESVA), de código abierto como Sentilo o', 'INSTITUT FÜR NORMUNG E.V. (Instituto Alemán de Normalización) DIN 45657 (1997-07) DIN 45657 (20 14-07) ANSI – INSTITUTO AMERICANO DE ESTÁNDARES NACIONALES ANSI S1.4-1983 más ANSI S1.4A-1985 Enmienda, tipo 1 ANSI/ASA S1.4, Parte-2014, clase 1, grupo X/Z ANSI S1.43– 1997, tipo 1 IEC – COMISIÓN', 'con ponderación A: de 23.2 a 140.3 dB, de acuerdo con IEC 61672: 1 kHz: de 43.3 a 143.3 dB.', 'producto (incl. EMC) EN/IEC 61672-1:2013: Electroacústica – Sonómetros – Parte 1: Especificaciones EN/IEC 61260-1:2014: Electroacústica – Filtros de banda de octava y de banda fraccionaria de octava – Parte 1: Especificaciones Temperatura IEC 60068-2-1 e IEC 60068-2-2: Pruebas ambientales. Frío y', 'proporciona una solución completa para una tarea específica. La medición, el análisis y la documentación precisos del ruido nunca han sido tan sencillos. Usos y características Usos [LISTA] Mediciones de ruido que requieren instrumentación compatible con IEC 61672 [LISTA] Inspección de ruido de', '1 de 2001-09) para bandas de 1/1-octava y 1/3-octava, Clase 0, grupo X/Z, y todos los filtros. También cumple con la norma IEC 61260-1:2014 para bandas de 1/1-octava y 1/3-octava, clase 1, grupo X/Z, y todos los filtros. Según el ANSI – American National Standards Institute, cumple con la norma', 'Guía de software WELMEC 7.2 - 2014 2245 -N-S SLM con Noise Partner 2245 -N-SC SLM con Noise Partner y calibrador 2245 -N-I SLM con Noise Partner 2245 -E-S SLM con Enviro Noise 2245 -E-SC SLM con ruido ambiental y calibrador 2245 -W-S SLM con ruido de trabajo 2245 -W-SC SLM con ruido de trabajo y']","Sonómetro B&K 2245 Sound Level Meter de HBK. 

Cumple los requisitos de electroacústica IEC 61672-1:2002-05 y IEC 61672-1:2013 Clase 1, Grupo X/Z. 

Cumple con los requisitos adicionales DIN 45657 (1997-07) y (2014-07). 

Cumple con los requisitos de medición de ruido IEC 60651 (1979) más la enmienda 1 (1993-02) y la enmienda 2 (2000-10), Tipo 1, Grupo X/Z. 

Cumplen con los requisitos integradores-promediadores IEC 60804 (2000-10), Tipo 1, Grupo X/Z. 

Además de los estándares americanos: ANSI S1.4-1983 más ANSI S1.4A-1985 Enmienda, tipo 1, ANSI/ASA S1.4, Parte-2014, clase 1, grupo X/Z y ANSI S1.43-1997, tipo 1. 

Cumple con los estándares de electroacústica: IEC 61260:1995-07 (más la Enmienda 1 (2001-09)), bandas de 1/1 de octava y bandas de 1/3 de octava, Clase 0, grupo X/Z, todos los filtros; IEC 61260-1:2014, bandas de 1/1 octava y bandas de 1/3 de octava, clase 1, grupo X/Z, todos los filtros octava, clase 1, grupo X/Z, todos los filtros. 

Además de los estándares americanos de electroacústica: ANSI S1.11-2004, bandas de 1/1 octava y 1/3 octava, clase 0, grupo X/Z, todos los filtros; ANSI/ASA S1.11 2014/Parte 1, bandas de 1/1 octava y bandas de 1/3 de octava, clase 1, grupo X/ Z, todos los filtros. 

En cuanto a los requisitos físicos. Sus dimensiones son de 260 × 68 × 37 mm incluyendo preamplificador y micrófono. No se incluye la lista de accesorios disponibles. Equipo de medida ajustado a IEC 61672. Incluye protección IP 55, EN/IEC 60529 (1989). Temperatura de operación desde los -25ºC a los +70ºC. Rango dinámico lineal desde 23.2 a 140.3 dB. Rango dinámico desde 23.2 a 140.3 dB. Capaz de presentar resultado en frecuencia A, B, C y Z. Capacidad de realizar el análisis de frecuencias en octavas y tercios de octava. No habla del grado de precisión del Real Decreto 1367/2007. Rango dinámico hasta 140.3 dB. Tiene transferencia de datos en tiempo real. Fuente de alimentación 100 – 240 VAC, 50/60 Hz, 0.45 A. ",HBK-36-sonometro,sonometro,,1.0,,0.8718759773389859,0.7032859966755518,0.7571775913238525,0.757071316242218,0.7571244835853577,1,9,0.5,"[Document(page_content='[TABLA] El modelo de sonómetro B&K 2245 del proveedor HBK cumple con varias normativas y estándares técnicos: [LISTA] Seguridad eléctrica: Cumple con la Radio Equipment Directive 2014/53/EU, RCM, China RoHS, WEEE y FCC. Normas específicas incluyen EN/IEC 61010-1, ANSI/UL 61010-1 y CSA C22.2', metadata={'nombre_pdf': 'hbk-bk-2245-Data_Sheet', 'modelo': 'B&K 2245', 'proveedor': 'HBK', 'equipo': 'sonometro', 'tabla': True}), Document(page_content='[LISTA] Sensor con precisión clase 1 según IEC 61672-1. [LISTA] Protección contra agentes externos con kit de exterior: viento, lluvia, pájaros. Mantiene clase 1. Protección IP65. [LISTA] Completamente integrable en diferentes plataformas: Noise- Platform (CESVA), de código abierto como Sentilo o', metadata={'nombre_pdf': 'cesva-ta120', 'modelo': 'Clase 1 modelo TA120', 'proveedor': 'CESVA', 'equipo': 'sonometro'}), Document(page_content='INSTITUT FÜR NORMUNG E.V. (Instituto Alemán de Normalización) DIN 45657 (1997-07) DIN 45657 (20 14-07) ANSI – INSTITUTO AMERICANO DE ESTÁNDARES NACIONALES ANSI S1.4-1983 más ANSI S1.4A-1985 Enmienda, tipo 1 ANSI/ASA S1.4, Parte-2014, clase 1, grupo X/Z ANSI S1.43– 1997, tipo 1 IEC – COMISIÓN', metadata={'nombre_pdf': 'hbk-bk-2245-Data_Sheet', 'modelo': 'B&K 2245', 'proveedor': 'HBK', 'equipo': 'sonometro'}), Document(page_content='con ponderación A: de 23.2 a 140.3 dB, de acuerdo con IEC 61672: 1 kHz: de 43.3 a 143.3 dB.', metadata={'nombre_pdf': 'hbk-bk-2245-Data_Sheet', 'modelo': 'B&K 2245', 'proveedor': 'HBK', 'equipo': 'sonometro', 'tabla': True}), Document(page_content='producto (incl. EMC) EN/IEC 61672-1:2013: Electroacústica – Sonómetros – Parte 1: Especificaciones EN/IEC 61260-1:2014: Electroacústica – Filtros de banda de octava y de banda fraccionaria de octava – Parte 1: Especificaciones Temperatura IEC 60068-2-1 e IEC 60068-2-2: Pruebas ambientales. Frío y', metadata={'nombre_pdf': 'hbk-bk-2245-Data_Sheet', 'modelo': 'B&K 2245', 'proveedor': 'HBK', 'equipo': 'sonometro'}), Document(page_content='proporciona una solución completa para una tarea específica. La medición, el análisis y la documentación precisos del ruido nunca han sido tan sencillos. Usos y características Usos [LISTA] Mediciones de ruido que requieren instrumentación compatible con IEC 61672 [LISTA] Inspección de ruido de', metadata={'nombre_pdf': 'hbk-bk-2245-Data_Sheet', 'modelo': 'B&K 2245', 'proveedor': 'HBK', 'equipo': 'sonometro'}), Document(page_content='1 de 2001-09) para bandas de 1/1-octava y 1/3-octava, Clase 0, grupo X/Z, y todos los filtros. También cumple con la norma IEC 61260-1:2014 para bandas de 1/1-octava y 1/3-octava, clase 1, grupo X/Z, y todos los filtros. Según el ANSI – American National Standards Institute, cumple con la norma', metadata={'nombre_pdf': 'hbk-bk-2245-Data_Sheet', 'modelo': 'B&K 2245', 'proveedor': 'HBK', 'equipo': 'sonometro', 'tabla': True}), Document(page_content='Guía de software WELMEC 7.2 - 2014 2245 -N-S SLM con Noise Partner 2245 -N-SC SLM con Noise Partner y calibrador 2245 -N-I SLM con Noise Partner 2245 -E-S SLM con Enviro Noise 2245 -E-SC SLM con ruido ambiental y calibrador 2245 -W-S SLM con ruido de trabajo 2245 -W-SC SLM con ruido de trabajo y', metadata={'nombre_pdf': 'hbk-bk-2245-Data_Sheet', 'modelo': 'B&K 2245', 'proveedor': 'HBK', 'equipo': 'sonometro'})]"
"Las especificaciones mínimas de los sensores serán: [LISTA] Principio de detección basado en la variación del campo magnético. [LISTA] El sensor mide, con un intervalo estándar de 3 segundos (configurable), las variaciones del campo magnético a una frecuencia también configurable. [LISTA] El sensor se puede instalar en cualquier lugar de una plaza de estacionamiento en línea, incluida el centro, el bordillo o la acera. No es necesario quitar los vehículos para instalar el sensor. [LISTA] Los sensores deben quedar al ras del pavimento, no sobresalir del mismo y estar cubiertos con un material antideslizante que se integre con el entorno urbano. [LISTA] Los sensores son reutilizables en otra ubicación y se pueden desinstalar fácilmente. [LISTA] Grado de protección IP67. [LISTA] Grado de protección IK10. [LISTA] Marcado CE. [LISTA] Proporcionar datos de ocupación en tiempo real. [LISTA] Identificador unívoco del sensor. [LISTA] Deben informar sobre sus parámetros operativos regularmente. [LISTA] En el caso de que los sensores no reciban una confirmación de recepción del mensaje enviado, se envía el mismo mensaje hasta 5 veces. [LISTA] El sensor envía cada 7 horas (configurable) una prueba de vida, cuando no hay ningún cambio. [LISTA] Disponer de auto calibración. [LISTA] Confirmar la recepción de los mensajes. [LISTA] Rango de temperatura entre -30⁰C y 65⁰C [LISTA] Precisión en la detección de ocupación superior al 97% y del 95% de detección de las rotaciones. [LISTA] Robusto ante la presencia de perturbaciones magnéticas externas. [LISTA] Disponer de una vida útil garantizada de 5 años. [LISTA] Resistente al desgaste, agua, disolventes, luz, altas temperaturas y abrasión.","- Nombre del equipo y proveedor: Smart Parking Node, Libelium.
- Especificaciones que se han preguntado y aparecen en el contexto:
  - Principio de detección basado en la variación del campo magnético.
  - El sensor mide, con un intervalo estándar de 3 segundos (configurable), las variaciones del campo magnético a una frecuencia también configurable.
  - El sensor se puede instalar en cualquier lugar de una plaza de estacionamiento en línea, incluida el centro, el bordillo o la acera. No es necesario quitar los vehículos para instalar el sensor.
  - Los sensores deben quedar al ras del pavimento, no sobresalir del mismo y estar cubiertos con un material antideslizante que se integre con el entorno urbano.
  - Los sensores son reutilizables en otra ubicación y se pueden desinstalar fácilmente.
  - Grado de protección IP67.
  - Grado de protección IK10.
  - Marcado CE.
  - Proporcionar datos de ocupación en tiempo real.
  - Identificador unívoco del sensor.
  - Deben informar sobre sus parámetros operativos regularmente.
  - En el caso de que los sensores no reciban una confirmación de recepción del mensaje enviado, se envía el mismo mensaje hasta 5 veces.
  - El sensor envía cada 7 horas (configurable) una prueba de vida, cuando no hay ningún cambio.
  - Disponer de auto calibración.
  - Confirmar la recepción de los mensajes.
  - Rango de temperatura entre -30⁰C y 65⁰C.
  - Precisión en la detección de ocupación superior al 97% y del 95% de detección de las rotaciones.
  - Robusto ante la presencia de perturbaciones magnéticas externas.
  - Disponer de una vida útil garantizada de 5 años.
  - Resistente al desgaste, agua, disolventes, luz, altas temperaturas y abrasión.","['magnético”. Figura 7.1.1: Arquitectura de red de Smart Parking 7.2 Cómo colocar los nodos El punto de instalación correcto es el centro de la plaza de aparcamiento para garantizar la mejor detección. Es posible instalar los nodos en diferentes configuraciones de plazas de aparcamiento: [LISTA]', 'EN301489-3, EN301 489-17, EN50130-4 (EN61000-4-2, EN61000-4-3, EN61000-4-4, EN61000-4-5, EN61000-4-6), EN50121-4 (EN55016-2-1, EN61000-4-2, EN61000-4-3, EN61000-4-4, EN61000-4-5, EN61000-4-6) Especificaciones ambientales EN50130-5 ClaseIVA (EN60068-2-2, EN60068-2-5, EN60068-2-6, EN60068-2-18,', 'del sensor hacia la acera (evitando la calzada de vehículos), mediante giro de cazoleta. Condiciones admisibles de trabajo a temperatura de entre -20⁰C y 60⁰C. SENSOR DE DETECCIÓN DE ILUMINANCIA MEDIA DEL ENTORNO Sensor Crepuscular (para la detección de la iluminancia de la vía), permuta el sistema', '[LISTA] Sensor con precisión clase 1 según IEC 61672-1. [LISTA] Protección contra agentes externos con kit de exterior: viento, lluvia, pájaros. Mantiene clase 1. Protección IP65. [LISTA] Completamente integrable en diferentes plataformas: Noise- Platform (CESVA), de código abierto como Sentilo o', 'un tiempo de ""suspensión"" específico y luego se despierta, mide y aplica el algoritmo de detección para detectar cambios en el espacio de estacionamiento. Si se detecta un cambio de ""libre"" a ""ocupado"" o viceversa, se envía una trama ""Información"". Si no se produjo ningún cambio durante el último', '[TABLA] El modelo Evolis del proveedor Elancity es un radar pedagógico con las siguientes especificaciones técnicas: [LISTA] Posición de la ruedecilla de ajuste configurable para velocidades de 30 km/h, 50 km/h, 90 km/h, 100 km/h y 120 km/h. Estas configuraciones pueden variar según la zona', 'con exactitud a cada vehículo. Otra ventaja consiste en que gracias al uso de la tecnología radar no se requie- ran inversiones ni obras invasivas en la calzada debido a la instalación de sensores de edición. [LISTA] Moderna tecnología radar 2D [LISTA] No invasiva para la calzada [LISTA] Medición', 'Fuente de alimentación Baterías integradas de cloruro de tionilo de litio (LiSOCl2); de 410 años* Tiempo de suspensión configurable Mín.: 10 s / máx.: 10 min Protocolo de radio Módulo LoRaWAN Detección dual Radar (principal) y magnético (de respaldo) Aprovisionamiento Listo para instalar (las ID y']","Sensor Smart Parking Node de Libelium. Principio de detección  basado en radar y campo magnético. Ciclo de medida de 340 ms y ciclo de media + envío de 6 s. Se puede instalar en distintos lugares de una plaza de aparcamiento. Permite que la instalación no sobresalga del suelo. No habla sobre si son reusables. Tiene protección, IP 68 e IK 10. Certificación de mercado CE (Europa), FCC (USA) y UKCA. Permite un flujo de datos en tiempo real. Tiene etiqueta de identificado. Permite informar sobre sus parámetros en distintos intervalos de tiempo. No habla sobre qué sucede si no se recibe  una confirmación de recepción. Permite mandar pruebas de vida. Permite el autocalibrado. Confirma la recepción de mensajes. Temperatura de operación desde -20ºC a +65ºC. No se comenta el porcentaje de precisión. No dice si es robusto ante perturbaciones magnéticas externas. Vida útil esperada entre  4 y 10 años. Producto muy resistente.",Libelium-58-smart_parking_node,smart parking node,,0.0,,0.958754384586384,0.7310377082173785,0.6895391941070557,0.7322793006896973,0.7102668285369873,1,4,0.25,"[Document(page_content='magnético”. Figura 7.1.1: Arquitectura de red de Smart Parking 7.2 Cómo colocar los nodos El punto de instalación correcto es el centro de la plaza de aparcamiento para garantizar la mejor detección. Es posible instalar los nodos en diferentes configuraciones de plazas de aparcamiento: [LISTA]', metadata={'nombre_pdf': 'libelium-Smart_Parking_Technical_Guide', 'modelo': 'Cabina Smart Spot, Smart Parking Node', 'proveedor': 'Libelium', 'equipo': 'smart parking node'}), Document(page_content='EN301489-3, EN301 489-17, EN50130-4 (EN61000-4-2, EN61000-4-3, EN61000-4-4, EN61000-4-5, EN61000-4-6), EN50121-4 (EN55016-2-1, EN61000-4-2, EN61000-4-3, EN61000-4-4, EN61000-4-5, EN61000-4-6) Especificaciones ambientales EN50130-5 ClaseIVA (EN60068-2-2, EN60068-2-5, EN60068-2-6, EN60068-2-18,', metadata={'nombre_pdf': 'bosch-FLEXIDOME_IP_starlig_Data_sheet_esES_68669614475', 'modelo': 'FLEXIDOME IP starlight 8000i - 8MP', 'proveedor': 'Bosch', 'equipo': 'camara'}), Document(page_content='del sensor hacia la acera (evitando la calzada de vehículos), mediante giro de cazoleta. Condiciones admisibles de trabajo a temperatura de entre -20⁰C y 60⁰C. SENSOR DE DETECCIÓN DE ILUMINANCIA MEDIA DEL ENTORNO Sensor Crepuscular (para la detección de la iluminancia de la vía), permuta el sistema', metadata={'nombre_pdf': 'interlight-pasos-de-peatones', 'modelo': 'Paso de peatones inteligente', 'proveedor': 'Interlight', 'equipo': 'paso de peatones'}), Document(page_content='[LISTA] Sensor con precisión clase 1 según IEC 61672-1. [LISTA] Protección contra agentes externos con kit de exterior: viento, lluvia, pájaros. Mantiene clase 1. Protección IP65. [LISTA] Completamente integrable en diferentes plataformas: Noise- Platform (CESVA), de código abierto como Sentilo o', metadata={'nombre_pdf': 'cesva-ta120', 'modelo': 'Clase 1 modelo TA120', 'proveedor': 'CESVA', 'equipo': 'sonometro'}), Document(page_content='un tiempo de ""suspensión"" específico y luego se despierta, mide y aplica el algoritmo de detección para detectar cambios en el espacio de estacionamiento. Si se detecta un cambio de ""libre"" a ""ocupado"" o viceversa, se envía una trama ""Información"". Si no se produjo ningún cambio durante el último', metadata={'nombre_pdf': 'libelium-Smart_Parking_Technical_Guide', 'modelo': 'Cabina Smart Spot, Smart Parking Node', 'proveedor': 'Libelium', 'equipo': 'smart parking node'}), Document(page_content='[TABLA] El modelo Evolis del proveedor Elancity es un radar pedagógico con las siguientes especificaciones técnicas: [LISTA] Posición de la ruedecilla de ajuste configurable para velocidades de 30 km/h, 50 km/h, 90 km/h, 100 km/h y 120 km/h. Estas configuraciones pueden variar según la zona', metadata={'nombre_pdf': 'elancity-radar-pedagogico-evolis', 'modelo': 'Evolis', 'proveedor': 'Elancity', 'equipo': 'radar pedagogico', 'tabla': True}), Document(page_content='con exactitud a cada vehículo. Otra ventaja consiste en que gracias al uso de la tecnología radar no se requie- ran inversiones ni obras invasivas en la calzada debido a la instalación de sensores de edición. [LISTA] Moderna tecnología radar 2D [LISTA] No invasiva para la calzada [LISTA] Medición', metadata={'nombre_pdf': 'tradesegur-cabina-ruban', 'modelo': 'Cabina Urban', 'proveedor': 'Tradegesur', 'equipo': 'cinemometro sancionador'}), Document(page_content='Fuente de alimentación Baterías integradas de cloruro de tionilo de litio (LiSOCl2); de 410 años* Tiempo de suspensión configurable Mín.: 10 s / máx.: 10 min Protocolo de radio Módulo LoRaWAN Detección dual Radar (principal) y magnético (de respaldo) Aprovisionamiento Listo para instalar (las ID y', metadata={'nombre_pdf': 'libelium-Smart_Parking_Technical_Guide', 'modelo': 'Cabina Smart Spot, Smart Parking Node', 'proveedor': 'Libelium', 'equipo': 'smart parking node'})]"
"Las especificaciones mínimas de los pasos inteligentes serán: [LISTA] Señal S-13 LED rectangular 90x90. [SUBLISTA] Señal de aluminio de 90x90cm de lado con inserción de LEDs en orla y triángulo. [SUBLISTA] Color de LED: Orlas y Peatón rojo y paso blanco o Luminosidad: 5000-7700 mcd/LED o Angularidad: 30º o Protección de cableado y electrónica interior en material plástico antivibración y antihumedad. [LISTA] Detector de Peatones. [SUBLISTA] Dispositivo capaz de detectar la presencia de peatones mediante un sensor cuyo cono de detección alcanza hasta una distancia máxima de 10m. [SUBLISTA] Incorpora una unidad de radiofrecuencia para enviar y recibir señales de otros dispositivos de las mismas características. [LISTA] Señalización LED en calzada. [SUBLISTA] Sistema de balizamiento óptico empotrado para guiado y balizamiento viario tipo captafaros. [SUBLISTA] Índice de protección IP68. [SUBLISTA] Resistencia al impacto IK10. [LISTA] Estación Control y Comunicación RF. [SUBLISTA] Conexión a sensores o Encendido de dispositivos de alerta o Comunicación RF [LISTA] Sistema de alimentación solar (panel, baterías y regulador en señales) [LISTA] Poste de aluminio Ø76mm x 4m de largo y 3mm de espesor.","- Nombre del equipo y proveedor: Paso de peatones inteligente, Interlight.
- Especificaciones que se han preguntado y aparecen en el contexto:
  - Señal S-13 LED rectangular 90x90:
    - Señal de aluminio de 90x90cm de lado con inserción de LEDs en orla y triángulo.
    - Color de LED: Orlas y Peatón rojo y paso blanco.
    - Luminosidad: 5000-7700 mcd/LED.
    - Angularidad: 30º.
    - Protección de cableado y electrónica interior en material plástico antivibración y antihumedad.
  - Detector de Peatones:
    - Dispositivo capaz de detectar la presencia de peatones mediante un sensor cuyo cono de detección alcanza hasta una distancia máxima de 10m.
  - Señalización LED en calzada:
    - Índice de protección IP68.
    - Resistencia al impacto IK10.
  - Estación Control y Comunicación RF:
    - Conexión a sensores.
    - Encendido de dispositivos de alerta.
    - Comunicación RF.
  - Sistema de alimentación solar (panel, baterías y regulador en señales):
    - No se especifica en el contexto.
  - Poste de aluminio Ø76mm x 4m de largo y 3mm de espesor:
    - No se especifica en el contexto.","['Pasos de peatones lumínicos de encendido inteligente FICHA TÉCNICA SEGURIDAD VIAL SMARTCITY IOT APLICACIONES PLACAS LUMÍNICAS SSVI INTERLIGHT SP SL [LISTA] B14980296 [LISTA] C/ Imprenta de la Alborada 241, 1 CP14014 [LISTA] Córdoba FICHA TÉCNICA PASO DE PEATONES INTELIGENTE SSVI INTERLIGHT Paso de', 'pueden variar según la zona geográfica, con opciones estándar y específicas para zonas escolares. [LISTA] Velocidad mínima visualizada: 15 km/h. [LISTA] Límite de cambio de color configurable a 31 km/h, 51 km/h, 91 km/h, 101 km/h y 121 km/h. [LISTA] Límite de advertencia antes de pasar al color', 'DE DETECCIÓN DE PEATONES El sensor volumétrico es de tipo piroeléctrico pasivo, tiene una apertura de 30º (Para abarcar el tramo de acera sin detectar coches), y una longitud máxima reducida de 5,5 metros desde la colocación de la señal vertical. Mediante el empleo de dos tornillos exteriores,', 'son IP65 e IK10 (panel metacrilato IK07). Señales horizontales (18UD): La alimentación es de 7,2(SLine) – 22(SC)W (±5%), 12VDC 1,83A por unidad, con cable RV-K 0’6/1Kv 2X1 eq.(REBT). La protección eléctrica incluye fusibles tipo MIDI 5A inmunizados a vibración. El flujo luminoso es de 120 lúmenes,', 'muestra las características básicas del nodo Smart Parking. Dimensiones de la carcasa 200 x 200 x 37,25 mm Materiales de la carcasa Poliamida, polipropileno y fibra de vidrio Peso 0,813 kg (incluidos los accesorios de instalación) 0,540 kg (solo el nodo Smart Parking) Fuente de alimentación', '[TABLA] El modelo ""Paso de peatones inteligente"" del proveedor Interlight presenta las siguientes especificaciones técnicas: Alimentación de las marcas longitudinales (500x90mm) es de 7,2W (±5%) con 12VDC 0,6 A. El flujo luminoso de estas marcas es de 50 Lúmenes. Los colores de iluminación', 'código abierto como Sentilo o Propietarias como Telefónica o Smarty Planet. [LISTA] Dimensiones reducidas y fácil de instalar en farolas, luminarias, marquesinas, MUPIs, OPIs, vallas y postes publicitarios. [LISTA] Alimentación por red eléctrica, POE (Power over Ethernet), 12 VDC (Paneles solares*,', 'EN PUERTA INFERIOR DEL MÁSTIL). Frecuencia: Tras fallo esporádico por anomalía en la red de distribución (IMPULSO TIPO RAYO O PERTURBACIÓN GRAVE DE LA RED). PASOS DE PEATONES Escala: 1:100 Autor: Plano nº: 1 Proyecto: 13-04-2018 INFORME DE INSTALACIÓN PLANO GENERAL - TIPO DE MARCA: SLINE 500 X 90']","Paso de peatones inteligentes de InterLight. 

Tiene una señal normalizada S-13 LED con reflectancia RA2.  Permite el color de iluminación blanco. No nombra la luminosidad por LED. Tiene una apertura de 30º. Tiene protección eléctrica interna. El sensor tiene detección máxima de peatones hasta 5,5 m de distancia. Permite la transmisión inalámbrica de datos. No habla sobre el balizamiento. Posee el índice de protección de accesos IP68. Posee el índice de protección mecánico IK10. El sistema tiene conexión a sensores. No habla sobre el encendido de dispositivos de alerta. No comenta si tiene comunicación por radiofrecuencia. No se sabe si el sistema de alimentación es solar. Mástil de acero cuadrado 100 x 100 x 3000 mm y 2 mm de espesor. ",Interlight-70-paso_de_peatones,paso de peatones,,0.6363636363636364,,0.9436603394284626,0.2800449736231764,0.679398238658905,0.7206999063491821,0.6994398832321167,1,4,0.4,"[Document(page_content='Pasos de peatones lumínicos de encendido inteligente FICHA TÉCNICA SEGURIDAD VIAL SMARTCITY IOT APLICACIONES PLACAS LUMÍNICAS SSVI INTERLIGHT SP SL [LISTA] B14980296 [LISTA] C/ Imprenta de la Alborada 241, 1 CP14014 [LISTA] Córdoba FICHA TÉCNICA PASO DE PEATONES INTELIGENTE SSVI INTERLIGHT Paso de', metadata={'nombre_pdf': 'interlight-pasos-de-peatones', 'modelo': 'Paso de peatones inteligente', 'proveedor': 'Interlight', 'equipo': 'paso de peatones'}), Document(page_content='pueden variar según la zona geográfica, con opciones estándar y específicas para zonas escolares. [LISTA] Velocidad mínima visualizada: 15 km/h. [LISTA] Límite de cambio de color configurable a 31 km/h, 51 km/h, 91 km/h, 101 km/h y 121 km/h. [LISTA] Límite de advertencia antes de pasar al color', metadata={'nombre_pdf': 'elancity-radar-pedagogico-evolis', 'modelo': 'Evolis', 'proveedor': 'Elancity', 'equipo': 'radar pedagogico', 'tabla': True}), Document(page_content='DE DETECCIÓN DE PEATONES El sensor volumétrico es de tipo piroeléctrico pasivo, tiene una apertura de 30º (Para abarcar el tramo de acera sin detectar coches), y una longitud máxima reducida de 5,5 metros desde la colocación de la señal vertical. Mediante el empleo de dos tornillos exteriores,', metadata={'nombre_pdf': 'interlight-pasos-de-peatones', 'modelo': 'Paso de peatones inteligente', 'proveedor': 'Interlight', 'equipo': 'paso de peatones'}), Document(page_content='son IP65 e IK10 (panel metacrilato IK07). Señales horizontales (18UD): La alimentación es de 7,2(SLine) – 22(SC)W (±5%), 12VDC 1,83A por unidad, con cable RV-K 0’6/1Kv 2X1 eq.(REBT). La protección eléctrica incluye fusibles tipo MIDI 5A inmunizados a vibración. El flujo luminoso es de 120 lúmenes,', metadata={'nombre_pdf': 'interlight-pasos-de-peatones', 'modelo': 'Paso de peatones inteligente', 'proveedor': 'Interlight', 'equipo': 'paso de peatones', 'tabla': True}), Document(page_content='muestra las características básicas del nodo Smart Parking. Dimensiones de la carcasa 200 x 200 x 37,25 mm Materiales de la carcasa Poliamida, polipropileno y fibra de vidrio Peso 0,813 kg (incluidos los accesorios de instalación) 0,540 kg (solo el nodo Smart Parking) Fuente de alimentación', metadata={'nombre_pdf': 'libelium-Smart_Parking_Technical_Guide', 'modelo': 'Cabina Smart Spot, Smart Parking Node', 'proveedor': 'Libelium', 'equipo': 'smart parking node'}), Document(page_content='[TABLA] El modelo ""Paso de peatones inteligente"" del proveedor Interlight presenta las siguientes especificaciones técnicas: Alimentación de las marcas longitudinales (500x90mm) es de 7,2W (±5%) con 12VDC 0,6 A. El flujo luminoso de estas marcas es de 50 Lúmenes. Los colores de iluminación', metadata={'nombre_pdf': 'interlight-pasos-de-peatones', 'modelo': 'Paso de peatones inteligente', 'proveedor': 'Interlight', 'equipo': 'paso de peatones', 'tabla': True}), Document(page_content='código abierto como Sentilo o Propietarias como Telefónica o Smarty Planet. [LISTA] Dimensiones reducidas y fácil de instalar en farolas, luminarias, marquesinas, MUPIs, OPIs, vallas y postes publicitarios. [LISTA] Alimentación por red eléctrica, POE (Power over Ethernet), 12 VDC (Paneles solares*,', metadata={'nombre_pdf': 'cesva-ta120', 'modelo': 'Clase 1 modelo TA120', 'proveedor': 'CESVA', 'equipo': 'sonometro'}), Document(page_content='EN PUERTA INFERIOR DEL MÁSTIL). Frecuencia: Tras fallo esporádico por anomalía en la red de distribución (IMPULSO TIPO RAYO O PERTURBACIÓN GRAVE DE LA RED). PASOS DE PEATONES Escala: 1:100 Autor: Plano nº: 1 Proyecto: 13-04-2018 INFORME DE INSTALACIÓN PLANO GENERAL - TIPO DE MARCA: SLINE 500 X 90', metadata={'nombre_pdf': 'interlight-pasos-de-peatones', 'modelo': 'Paso de peatones inteligente', 'proveedor': 'Interlight', 'equipo': 'paso de peatones'})]"
"Las especificaciones mínimas de los radares pedagógicos serán: [LISTA] Radar aforador que permita medir la velocidad a nivel informativo y la obtención de datos de tráfico sobre los vehículos detectados (intensidad y velocidad). [LISTA] Señal en aluminio con reflectante amarillo de nivel III y poste de aluminio de 5 metros con abrazaderas. [LISTA] El panel deberá contar con el marcado CE, según norma EN-12899-1. [LISTA] Display LED 3 dígitos protegido por una lámina de alta resistencia antireflejos que permita su lectura a más de 150 metros. [LISTA] LED´s de alta luminosidad en rojo, naranja o amarillo (según velocidad del usuario). [LISTA] Ángulo de lectura de 120º [LISTA] Capacidad de obtener datos de tráfico con display apagado. [LISTA] Alimentación por panel solar [LISTA] Comunicación 4G para el envío de datos de tráfico capturados a la Plataforma ZBE, que permita generación de informes y estadísticas. [LISTA] Distancia de detección entre 150 y 200 metros. [LISTA] Rango de detección de velocidades: Entre 5 y 200 km/h, [LISTA] Grado de protección IP65. [LISTA] Rango de temperatura -20º C a +55º C [LISTA] Marcado CE.","- Nombre del equipo y proveedor: Evolis, Elancity.
- Especificaciones que se han preguntado y aparecen en el contexto:
  - Radar aforador que permite medir la velocidad a nivel informativo y la obtención de datos de tráfico sobre los vehículos detectados (intensidad y velocidad).
  - LED´s de alta luminosidad en rojo, naranja o amarillo (según velocidad del usuario).
  - Alimentación por panel solar.
  - Marcado CE.

- Nombre del equipo y proveedor: QX-33-TC-RAD, QUADREX.
- Especificaciones que se han preguntado y aparecen en el contexto:
  - Radar aforador que permite medir la velocidad a nivel informativo y la obtención de datos de tráfico sobre los vehículos detectados (intensidad y velocidad).
  - Alimentación mediante panel solar.
  - Comunicación 4G para el envío de datos de tráfico capturados a la Plataforma ZBE, que permite generación de informes y estadísticas.
  - Rango de detección de velocidades: Entre 5 y 200 km/h.","['[TABLA] El modelo Evolis del proveedor Elancity es un radar pedagógico con las siguientes especificaciones técnicas: [LISTA] Posición de la ruedecilla de ajuste configurable para velocidades de 30 km/h, 50 km/h, 90 km/h, 100 km/h y 120 km/h. Estas configuraciones pueden variar según la zona', '1.000.000 vehículos Interface para PC Nuevo software de comunicación y análisis Icoms Software Altura de montaje: entre 0,5 m y 4 m Radar Doppler integrado (24.125 GHz/5mW) Alimentación a 230 Vac Alimentación mediante panel solar Bluetooth o comunicaciones GSM ACCESORIOS Kit de montaje para postes', 'RA2, en material traslúcido para retroiluminado. - Encendido dinámico de las marcas viales en función de las especificaciones programadas para cada aplicación, mediante encendidos continuos, intermitentes, ó secuenciales. - Señal vertical dotada con sensor crepuscular para detección de iluminancia', 'verde y ámbar. Para las velocidades excesivas, el radar muestra verde y rojo.', 'alcance del radar 20 cm (no debe cambiarse) Longitud del alcance del radar 60 cm (no debe cambiarse) cambiarse) Umbral de radar 30 (no debe cambiarse) Modo de unión LoRaWAN 1 (OTAA) LoRaWAN DevEUI valor predeterminado de fábrica único LoRaWAN DevAddr, valor predeterminado de fábrica único LoRaWAN', 'específicas de TC-RADAR como aforador portátil de tráfico: Recuento de tráfico: captura de datos individuales tales como velocidad, número de vehículos, clase de vehículo, dirección y espacio entre vehículos 10 clases de velocidad,4 clases de vehículos Rango de medición 4 – 255 km / h Ajustable', '4.3 MONTAJE CON LA BARRA DE FIJACIÓN Manual de instrucciones [LISTA] Verificación 4.4 AVISO DE MONTAJE Antes de poner en servicio el radar pedagógico 4.5 ALIMENTACIÓN Y CONEXIÓN [LISTA] Alimentación [LISTA] Consumo del radar Manual de instrucciones [LISTA] Dispositivo de seguridad [LISTA]', 'DE DETECCIÓN DE PEATONES El sensor volumétrico es de tipo piroeléctrico pasivo, tiene una apertura de 30º (Para abarcar el tramo de acera sin detectar coches), y una longitud máxima reducida de 5,5 metros desde la colocación de la señal vertical. Mediante el empleo de dos tornillos exteriores,']","Una opción son los radares pedagógicos de Evolis. 

Es capaz de medir la velocidad de los coches y registrar estadísticas sobre el tráfico. No se comenta nada sobre si la señal se coloca en aluminio con reflectante. Cuenta con el marcado CE. Tiene una pantalla LED de 3 dígitos de 34 cm de alto brillo y de bajo consumo. Dispone de tres colores de visualización: verde, ámbar o rojo. No habla sobre el ángulo de lectura. El modo espía permite desactivar la visualización de datos con display apagado. Tiene alimentación por panel solar. Permite el envío de datos para generación de informes y estadísticas. Distancia de detección hasta 250 metros. Grado de protección IP64. No habla sobre el rango de temperatura. Tiene marcado CE. ",Elancity-78-radar_pedagogico,radar pedagogico,,0.9230769230769232,,0.9151667724995196,0.5145059788391656,0.6620438694953918,0.6921132206916809,0.6767446994781494,1,3,0.2727272727272727,"[Document(page_content='[TABLA] El modelo Evolis del proveedor Elancity es un radar pedagógico con las siguientes especificaciones técnicas: [LISTA] Posición de la ruedecilla de ajuste configurable para velocidades de 30 km/h, 50 km/h, 90 km/h, 100 km/h y 120 km/h. Estas configuraciones pueden variar según la zona', metadata={'nombre_pdf': 'elancity-radar-pedagogico-evolis', 'modelo': 'Evolis', 'proveedor': 'Elancity', 'equipo': 'radar pedagogico', 'tabla': True}), Document(page_content='1.000.000 vehículos Interface para PC Nuevo software de comunicación y análisis Icoms Software Altura de montaje: entre 0,5 m y 4 m Radar Doppler integrado (24.125 GHz/5mW) Alimentación a 230 Vac Alimentación mediante panel solar Bluetooth o comunicaciones GSM ACCESORIOS Kit de montaje para postes', metadata={'nombre_pdf': 'quadrex-aforador-qx-33-tc-rad', 'modelo': 'QX-33-TC-RAD', 'proveedor': 'QUADREX', 'equipo': 'radar aforador'}), Document(page_content='RA2, en material traslúcido para retroiluminado. - Encendido dinámico de las marcas viales en función de las especificaciones programadas para cada aplicación, mediante encendidos continuos, intermitentes, ó secuenciales. - Señal vertical dotada con sensor crepuscular para detección de iluminancia', metadata={'nombre_pdf': 'interlight-pasos-de-peatones', 'modelo': 'Paso de peatones inteligente', 'proveedor': 'Interlight', 'equipo': 'paso de peatones'}), Document(page_content='verde y ámbar. Para las velocidades excesivas, el radar muestra verde y rojo.', metadata={'nombre_pdf': 'elancity-radar-pedagogico-evolis', 'modelo': 'Evolis', 'proveedor': 'Elancity', 'equipo': 'radar pedagogico', 'tabla': True}), Document(page_content='alcance del radar 20 cm (no debe cambiarse) Longitud del alcance del radar 60 cm (no debe cambiarse) cambiarse) Umbral de radar 30 (no debe cambiarse) Modo de unión LoRaWAN 1 (OTAA) LoRaWAN DevEUI valor predeterminado de fábrica único LoRaWAN DevAddr, valor predeterminado de fábrica único LoRaWAN', metadata={'nombre_pdf': 'libelium-Smart_Parking_Technical_Guide', 'modelo': 'Cabina Smart Spot, Smart Parking Node', 'proveedor': 'Libelium', 'equipo': 'smart parking node'}), Document(page_content='específicas de TC-RADAR como aforador portátil de tráfico: Recuento de tráfico: captura de datos individuales tales como velocidad, número de vehículos, clase de vehículo, dirección y espacio entre vehículos 10 clases de velocidad,4 clases de vehículos Rango de medición 4 – 255 km / h Ajustable', metadata={'nombre_pdf': 'quadrex-aforador-qx-33-tc-rad', 'modelo': 'QX-33-TC-RAD', 'proveedor': 'QUADREX', 'equipo': 'radar aforador'}), Document(page_content='4.3 MONTAJE CON LA BARRA DE FIJACIÓN Manual de instrucciones [LISTA] Verificación 4.4 AVISO DE MONTAJE Antes de poner en servicio el radar pedagógico 4.5 ALIMENTACIÓN Y CONEXIÓN [LISTA] Alimentación [LISTA] Consumo del radar Manual de instrucciones [LISTA] Dispositivo de seguridad [LISTA]', metadata={'nombre_pdf': 'elancity-radar-pedagogico-evolis', 'modelo': 'Evolis', 'proveedor': 'Elancity', 'equipo': 'radar pedagogico'}), Document(page_content='DE DETECCIÓN DE PEATONES El sensor volumétrico es de tipo piroeléctrico pasivo, tiene una apertura de 30º (Para abarcar el tramo de acera sin detectar coches), y una longitud máxima reducida de 5,5 metros desde la colocación de la señal vertical. Mediante el empleo de dos tornillos exteriores,', metadata={'nombre_pdf': 'interlight-pasos-de-peatones', 'modelo': 'Paso de peatones inteligente', 'proveedor': 'Interlight', 'equipo': 'paso de peatones'})]"
"El monitor contará con las siguientes características [LISTA] Panel IP con retroiluminación LED directa. [LISTA] Tamaño 55”. [LISTA] 1920x1080. [LISTA] 700 cd. [LISTA] Marco de 0,88mm (0,44mm + 0,44mm). [LISTA] Haze level PRO 28%. [LISTA] Tamaño del pixel de 0,630mm. [LISTA] Contraste de 1700:1. [LISTA] Ángulo de visión de 178º / 178º. [LISTA] Tiempo de respuesta de 8msec. [LISTA] Frecuencia de 60Hz. [LISTA] Orientación: Horizontal y vertical. [LISTA] Slot para OPS (computación). [LISTA] Conectividad lazo tanto por Display Port como por Daisy Chain para tener redundancia. [LISTA] Calibración de fábrica, calibración por sensor y por software. [LISTA] Sensor mando distancia y que permite gestionar activación por movimiento y ajuste del brillo automático. [LISTA] Entrada análoga de vídeo 1 x VGA; Compuesto (RCA). [LISTA] Entrada digital de vídeo 1 x DVI-D (con HDCP); 1 x ranura OPS; 2 x DisplayPort (HDCP); 2 x HDMI (HDCP). [LISTA] Entrada análoga de audio 2 x 3,5 mm jack. [LISTA] Entrada digital de audio 2 x DisplayPort; 2 x HDMI. [LISTA] Control de entrada 1 x Remote Control (3.5 mm jack); 1 x RS232; 2 x LAN 100Mbit. [LISTA] Input Data 1 x microSD (MediaPlayer); 1 x USB 1.0 (Downstream); 1 x USB 1.0 (MediaPlayer); 1 x USB 2.0 (Upstream); 2 x USB 1.0 (Compute Module, 1 x 5V/2A powered). [LISTA] Salida digital de vídeo 1 x DisplayPort (loop through: DisplayPort, OPS slot-in PC); 1 x HDMI (loop through: HDMI, OPS slot-in PC, Mediaplayer). [LISTA] Salida análoga de audio 1 x 3,5 mm jack. [LISTA] Control de salida LAN 100Mbit. [LISTA] Temperatura ambiente de funcionamiento [°C] +0 a +40. [LISTA] Humedad ambiental de funcionamiento [%].","- Nombre del equipo y proveedor: Philips 55"" 55BDL2005X/00, Philips.
- Especificaciones que se han preguntado y aparecen en el contexto:
  - Panel IP con retroiluminación LED directa.
  - Tamaño 55”.
  - Resolución 1920x1080.
  - Tiempo de respuesta de 8ms.
  - Frecuencia de 60Hz.
  - Orientación: Horizontal y vertical.
  - Slot para OPS (computación).
  - Entrada análoga de vídeo 1 x VGA; Compuesto (RCA).
  - Entrada digital de vídeo 1 x DVI-D (con HDCP); 1 x ranura OPS; 2 x DisplayPort (HDCP); 2 x HDMI (HDCP).
  - Entrada análoga de audio 2 x 3,5 mm jack.
  - Entrada digital de audio 2 x DisplayPort; 2 x HDMI.
  - Control de entrada 1 x Remote Control (3.5 mm jack); 1 x RS232; 2 x LAN 100Mbit.
  - Input Data 1 x microSD (MediaPlayer); 1 x USB 1.0 (Downstream); 1 x USB 1.0 (MediaPlayer); 1 x USB 2.0 (Upstream); 2 x USB 1.0 (Compute Module, 1 x 5V/2A powered).
  - Salida digital de vídeo 1 x DisplayPort (loop through: DisplayPort, OPS slot-in PC); 1 x HDMI (loop through: HDMI, OPS slot-in PC, Mediaplayer).
  - Salida análoga de audio 1 x 3,5 mm jack.
  - Control de salida LAN 100Mbit.
  - Temperatura ambiente de funcionamiento [°C] +0 a +40.","['panel: 1920x1080p [SUBLISTA] Resolución óptima: 1920 x 1080@60 Hz [SUBLISTA] Brillo: 500cd/m² [SUBLISTA ] Relación de contraste (típica): 1200 : 1 [SUBLISTA] Relación de contraste dinámico: 500,000 : 1 [SUBLISTA] Tiempo de respuesta (típica): 8 ms [SUBLISTA] Relación de aspecto: 16:9 [SUBLISTA]', '(3,5 mm). imágenes Configuración sin esfuerzo [LISTA] Agregue potencia de procesamiento de Android con un módulo CRD50 opcional [LISTA] Opere, monitoree y mantenga con CMND y controle una potente solución de sistema [LISTA] Cree videowalls 4K en mosaico de cualquier tamaño. La ranura OPS permite la', 'Seguridad EN62368-1 IEC62368-1 UL62368-1 EN/IEC/UL60950-22 CAN/CSA-C22.2 N.º 60950-22:17, segunda edición Rendimiento de imágenes IEC62676-5 Protección contra impactos EN62262 (IK10): 2002 Índice de protección frente a entrada EN 60529 (IP66) UL50E (NEMAtipo4X) Norma Tipo Cumplimiento de la', 'Retroiluminación LED directa de 55"" Full HD 500 cd/m² 55BDL2005X Vaya a lo grande Pantalla de videowall versátil. Llame la atención con una pantalla de videowall profesional Philips X-Line. El contraste nítido y los biseles estrechos permiten obtener imágenes claras y sin distracciones. Ya sea que', 'con 4 monitores HD-RMWS4-4MN Software ACC Client NÚMERO DE REFERENCIA DE LA PANTALLA PRINCIPALES CARACTERÍSTICAS NVR Standard HD-NVR4-STD - 16 TB/24 TB/32 TB/48 TB NVR Valor HD-NVR3-VAL - 3 TB/6 TB a 12 TB/18 TB Software ACC Server REQUISITOS DEL SISTEMA MÍNIMO RECOMENDADO Sistema operativo Windows', '[TABLA] El modelo 6860N del proveedor ALE cuenta con las siguientes especificaciones técnicas: Puerto USB, Puerto EMP fuera de banda, Puerto RS-232 y Puerto de consola (micro-USB). Dispone de 3 ventiladores. La altitud operativa es de hasta 13,000 ft. La temperatura de funcionamiento varía de 0 °C a', 'en mosaico: Hasta 10 x 10 [SUBLISTA] Software de control: SICP / CMND&Control Dimensiones [SUBLISTA] Dimensiones del conjunto (AnxAlxPr): 1213,5x684,3x97,8 mm [SUBLISTA] Peso del producto : 28,8 kg [SUBLISTA] Montaje en pared: 400 x 400 mm, M6 [SUBLISTA] Peso del producto (lb): 63,49 lb [SUBLISTA]', 'es automático o manual. El control de parpadeo se ajusta a 60 Hz o 50 Hz. El balance de blancos puede ser automático o manual. La compensación de contraluz se puede activar o desactivar. Se pueden configurar hasta 64 zonas de privacidad en 3D. Se permiten 500 preselecciones con nombre y 10 rondas']","Como monitor para el videowall se puede usar 55” 55BDL2005X/00 MONITOR VW 55 MARCO 3 5 MM de Philips. 

Tiene panel IPS con retroiluminación LED. Tamaño de 54.6” (55”). Resolución del panel 1920x1080p. Brillo de 500 cd/m2. Marco superior e inferior de 2.3 mm, marco lateral de 1.2 mm. Haze del 25%. Tamaño del píxel de 0.63 mm. Ratio de contraste 1200:1. Ángulo de visión 178 / 178 grados. Tiempo de respuesta de 8 ms. Frecuencia de 60 Hz. Admite orientación horizontal y vertical. Tiene ranura de OPS. Tiene salida de video por DisplayPort 1.2 como por RS232 Daisy Chain. Permite calibración. Admite control por mando a distancia. Incluye entrada de video Component (BNC x3), Composite (Share component Y), Display Port1.2 (x1), DVI-D, HDMI 1.4 (x2), USB 2.0 (x1), VGA (Analog D-Sub). Incluye conexión OPS. Incluye entrada de audio RCA Izquierda/Derecha y entrada jack 3.5 mm (x2). Salida de video DisplayPort 1.2 (x1), DVI-I (x1). Control de entrada RS232, IR Loopthrough, DisplayPort, DVI Loopthrough. Salida de video: DisplayPort 1.2 (x1), DVI-I (x1). Salida de audio 3.5mm jack. Tiene control de salida LAN. Temperatura de funcionamiento de +0ºC a +40ºC. Humedad de funcionamiento del 20 al 80%. ",Philips-92-monitor,monitor,,0.0,,0.9423531264175528,0.6605745294680951,0.6986621022224426,0.6993238925933838,0.6989928483963013,1,9,0.3333333333333333,"[Document(page_content='panel: 1920x1080p [SUBLISTA] Resolución óptima: 1920 x 1080@60 Hz [SUBLISTA] Brillo: 500cd/m² [SUBLISTA ] Relación de contraste (típica): 1200 : 1 [SUBLISTA] Relación de contraste dinámico: 500,000 : 1 [SUBLISTA] Tiempo de respuesta (típica): 8 ms [SUBLISTA] Relación de aspecto: 16:9 [SUBLISTA]', metadata={'nombre_pdf': 'philips-monitor-55BDL2005X-00', 'modelo': '55"" 55BDL2005X/00', 'proveedor': 'Philips', 'equipo': 'monitor'}), Document(page_content='(3,5 mm). imágenes Configuración sin esfuerzo [LISTA] Agregue potencia de procesamiento de Android con un módulo CRD50 opcional [LISTA] Opere, monitoree y mantenga con CMND y controle una potente solución de sistema [LISTA] Cree videowalls 4K en mosaico de cualquier tamaño. La ranura OPS permite la', metadata={'nombre_pdf': 'philips-monitor-55BDL2005X-00', 'modelo': '55"" 55BDL2005X/00', 'proveedor': 'Philips', 'equipo': 'monitor'}), Document(page_content='Seguridad EN62368-1 IEC62368-1 UL62368-1 EN/IEC/UL60950-22 CAN/CSA-C22.2 N.º 60950-22:17, segunda edición Rendimiento de imágenes IEC62676-5 Protección contra impactos EN62262 (IK10): 2002 Índice de protección frente a entrada EN 60529 (IP66) UL50E (NEMAtipo4X) Norma Tipo Cumplimiento de la', metadata={'nombre_pdf': 'bosch-NDE_5703_AL_Data_sheet_esES_98577430411', 'modelo': 'FLEXIDOME outdoor 5100i IR (NDE-5703-AL)', 'proveedor': 'Bosch', 'equipo': 'camara'}), Document(page_content='Retroiluminación LED directa de 55"" Full HD 500 cd/m² 55BDL2005X Vaya a lo grande Pantalla de videowall versátil. Llame la atención con una pantalla de videowall profesional Philips X-Line. El contraste nítido y los biseles estrechos permiten obtener imágenes claras y sin distracciones. Ya sea que', metadata={'nombre_pdf': 'philips-monitor-55BDL2005X-00', 'modelo': '55"" 55BDL2005X/00', 'proveedor': 'Philips', 'equipo': 'monitor'}), Document(page_content='con 4 monitores HD-RMWS4-4MN Software ACC Client NÚMERO DE REFERENCIA DE LA PANTALLA PRINCIPALES CARACTERÍSTICAS NVR Standard HD-NVR4-STD - 16 TB/24 TB/32 TB/48 TB NVR Valor HD-NVR3-VAL - 3 TB/6 TB a 12 TB/18 TB Software ACC Server REQUISITOS DEL SISTEMA MÍNIMO RECOMENDADO Sistema operativo Windows', metadata={'nombre_pdf': 'avigilon-acc7', 'modelo': 'ACC7-ENT, ACC7-ENT-FO, ACC7-POS-STR ACC7 POS', 'proveedor': 'Avigilon', 'equipo': 'licencia'}), Document(page_content='[TABLA] El modelo 6860N del proveedor ALE cuenta con las siguientes especificaciones técnicas: Puerto USB, Puerto EMP fuera de banda, Puerto RS-232 y Puerto de consola (micro-USB). Dispone de 3 ventiladores. La altitud operativa es de hasta 13,000 ft. La temperatura de funcionamiento varía de 0 °C a', metadata={'nombre_pdf': 'ale-omniswitch-6860-datasheet-es', 'modelo': '6860N', 'proveedor': 'ALE', 'equipo': 'switch', 'tabla': True}), Document(page_content='en mosaico: Hasta 10 x 10 [SUBLISTA] Software de control: SICP / CMND&Control Dimensiones [SUBLISTA] Dimensiones del conjunto (AnxAlxPr): 1213,5x684,3x97,8 mm [SUBLISTA] Peso del producto : 28,8 kg [SUBLISTA] Montaje en pared: 400 x 400 mm, M6 [SUBLISTA] Peso del producto (lb): 63,49 lb [SUBLISTA]', metadata={'nombre_pdf': 'philips-monitor-55BDL2005X-00', 'modelo': '55"" 55BDL2005X/00', 'proveedor': 'Philips', 'equipo': 'monitor'}), Document(page_content='es automático o manual. El control de parpadeo se ajusta a 60 Hz o 50 Hz. El balance de blancos puede ser automático o manual. La compensación de contraluz se puede activar o desactivar. Se pueden configurar hasta 64 zonas de privacidad en 3D. Se permiten 500 preselecciones con nombre y 10 rondas', metadata={'nombre_pdf': 'avigilon-h5a-rugged-ptz-camera-datasheet-es', 'modelo': 'H5A PTZ Resistente', 'proveedor': 'Avigilon', 'equipo': 'camara', 'tabla': True})]"
"Estación de trabajo: o Procesador I3. [LISTA] 8 Gb de RAM DDR4. [LISTA] Tarjeta de video Intel. [LISTA] Hasta 18 transmisiones principales a 2MP y 30fps. [LISTA] Combinación de hasta 2: DP y HDMI con adaptadores de DP a HMDI. [LISTA] SSD M.2 PCIe NVMe Clase 35 de 256 GB. [LISTA] 2 puertos de 1 Gigabit Ethernet RJ-45. [LISTA] Teclado y ratón USB. [LISTA] Unidad óptica DVD-RW. [LISTA] Certificaciones directivas UL, cUL, CE, UKCA, RCM, CCC, KC, VCCI, NRCS, BSMI, NOM, RoH. [LISTA] Certificaciones de seguridad: EN/IEC 62368-1. [LISTA] Certificación de inmunidad electromagnética: EN 55035.","- Nombre del equipo y proveedor: Avigilon RM7-WKS-2MN-EU
- Especificaciones que se han preguntado y aparecen en el contexto:
  - Procesador: Intel Core™ i3 (12ª generación)
  - Memoria: 8 GB DDR4 RAM
  - Tarjeta de video: Intel
  - SSD: M.2 PCIe NVMe Clase 35 de 256 GB
  - Puertos Ethernet: 2 puertos de 1 Gigabit Ethernet RJ-45
  - Teclado y ratón: USB
  - Unidad óptica: DVD-RW","['2: DP y HDMI (se suministran adaptadores HDMI) Sistema operativo Microsoft Windows 10 IoT Enterprise LTSC (2021) Procesador Intel Core™i5 (12ª generación) Intel Core™i3 (12ª generación) Memoria 32 GB DDR4 RAM 8 GB DDR4 RAM Unidad del sistema operativo SSD M.2 PCIe NVMe Clase 35 de 256 GB Interfaz', '[TABLA] El modelo RM7-WKS-2MN-EU de la workstation del proveedor Avigilon tiene las siguientes especificaciones técnicas: Entrada de potencia de 90 a 264 VCA, 50/60 Hz, conmutación automática. Fuente de alimentación única no redundante. Consumo de energía de 300 W.', 'red 1 Gbps 1 Gbps Espacio en disco duro 500 MB 500 MB NÚMERO DE REFERENCIA DE LA PANTALLA PRINCIPALES CARACTERÍSTICAS Estación de trabajo profesional de supervisión remota de alto rendimiento con 2 monitores HD-RMWS3-2MN [LISTA] Precargado con el software ACC Client. [LISTA] Compatible con', 'GHz) y se recomienda un Intel Core™ i5 (Quad-core, 3,3 GHz). La memoria RAM mínima es DDR3 de 4 GB y se recomienda DDR4 de 8 GB. La tarjeta de vídeo mínima debe ser PCI Express, compatible con DirectX 10.0 y con 256 MB de RAM, y se recomienda una NVIDIA Quadro P620. La interfaz de red debe ser de 1', 'cm (1.73 in.) 4.4 cm (1.73 in.) Peso (chasis y ventilador) 6.7 kg (14.77 lb) 6.6 kg (14.55 lb) Peso del envío (chasis completo***) 10 kg (22.04 lb) 10.5 kg (23.06 lb) Temperatura de funcionamiento Flujo de aire de delante hacia atrás De 0 °C a 45 °C (32 °F - 113 °F) Apagado 55 °C De 0 °C a 45 °C', 'de micrófonos (4 micrófonos) Clasificación de audio, localización de audio Seguridad Módulo de plataforma segura (TPM 2.0), certificados instalados de fábrica, sin contraseñas predeterminadas Autenticación de acceso obligatoria, cifrado HTTPS/TLS Fuente de alimentación PoE+ (802.3at tipo 2),', 'Interfaces compartidas 16 15 14 13 20 18 19 17 20 18 19 17 X1 X2 6 4 5 2 3 1 7 8 9 1U SOC4 / 480GB AC DUAL Características de hardware Especificaciones Nota: Todos los valores de rendimiento son “hasta” y varían según la configuración del sistema. 1 La prueba de rendimiento de VPN IPsec utiliza', 'de 1 Gigabit Ethernet RJ-45 (1000Base-T). Unidad óptica: DVD-RW. Gráficos: NVIDIA T1000 (8 GB).']","Estación de trabajo RM7-WKS-2MN-EU de AVIGILON. 

Tiene un procesador Intel i3 de 12ª generación. RAM DDR4 de 8 Gb. Gráficos integrados Intel. Hasta 18 transmisiones principales a 2MP a 30 fps. Combinación de hasta 2: DP y HDM (se suministran adaptadores HDMI). Unidad de sistema operativo SSD M.2 PCIe NVMe Clase 35 de 256 GB. Interfaz de red 2 puertos de 1 Gigabit Ethernet RJ-45 (1000Base-T). Incluye teclado USB, mouse USB, cable de alimentación, 2 adaptadores DP a HDMI. Unidad óptica DVD-RW. Certificaciones directivas UL, cUL, CE, UKCA, RCM, CCC, KC, VCCI, NRCS, BSMI, NOM, RoH. Certificaciones de seguridad EN/IEC 62368-1. Certificación de inmunidad electromagnética EN 55035. ",Avigilon-95-workstation,workstation,,0.0,,0.943009532560322,0.6643004848763895,0.7426202893257141,0.6549045443534851,0.6960096955299377,1,7,0.5833333333333334,"[Document(page_content='2: DP y HDMI (se suministran adaptadores HDMI) Sistema operativo Microsoft Windows 10 IoT Enterprise LTSC (2021) Procesador Intel Core™i5 (12ª generación) Intel Core™i3 (12ª generación) Memoria 32 GB DDR4 RAM 8 GB DDR4 RAM Unidad del sistema operativo SSD M.2 PCIe NVMe Clase 35 de 256 GB Interfaz', metadata={'nombre_pdf': 'avigilon-rm7-wks-datasheet-es', 'modelo': 'RM7-WKS-2MN-EU', 'proveedor': 'Avigilon', 'equipo': 'workstation'}), Document(page_content='[TABLA] El modelo RM7-WKS-2MN-EU de la workstation del proveedor Avigilon tiene las siguientes especificaciones técnicas: Entrada de potencia de 90 a 264 VCA, 50/60 Hz, conmutación automática. Fuente de alimentación única no redundante. Consumo de energía de 300 W.', metadata={'nombre_pdf': 'avigilon-rm7-wks-datasheet-es', 'modelo': 'RM7-WKS-2MN-EU', 'proveedor': 'Avigilon', 'equipo': 'workstation', 'tabla': True}), Document(page_content='red 1 Gbps 1 Gbps Espacio en disco duro 500 MB 500 MB NÚMERO DE REFERENCIA DE LA PANTALLA PRINCIPALES CARACTERÍSTICAS Estación de trabajo profesional de supervisión remota de alto rendimiento con 2 monitores HD-RMWS3-2MN [LISTA] Precargado con el software ACC Client. [LISTA] Compatible con', metadata={'nombre_pdf': 'avigilon-acc7', 'modelo': 'ACC7-ENT, ACC7-ENT-FO, ACC7-POS-STR ACC7 POS', 'proveedor': 'Avigilon', 'equipo': 'licencia'}), Document(page_content='GHz) y se recomienda un Intel Core™ i5 (Quad-core, 3,3 GHz). La memoria RAM mínima es DDR3 de 4 GB y se recomienda DDR4 de 8 GB. La tarjeta de vídeo mínima debe ser PCI Express, compatible con DirectX 10.0 y con 256 MB de RAM, y se recomienda una NVIDIA Quadro P620. La interfaz de red debe ser de 1', metadata={'nombre_pdf': 'avigilon-acc7', 'modelo': 'ACC7-ENT, ACC7-ENT-FO, ACC7-POS-STR ACC7 POS', 'proveedor': 'Avigilon', 'equipo': 'licencia', 'tabla': True}), Document(page_content='cm (1.73 in.) 4.4 cm (1.73 in.) Peso (chasis y ventilador) 6.7 kg (14.77 lb) 6.6 kg (14.55 lb) Peso del envío (chasis completo***) 10 kg (22.04 lb) 10.5 kg (23.06 lb) Temperatura de funcionamiento Flujo de aire de delante hacia atrás De 0 °C a 45 °C (32 °F - 113 °F) Apagado 55 °C De 0 °C a 45 °C', metadata={'nombre_pdf': 'ale-omniswitch-6900-datasheet-es', 'modelo': '6900', 'proveedor': 'ALE', 'equipo': 'switch'}), Document(page_content='de micrófonos (4 micrófonos) Clasificación de audio, localización de audio Seguridad Módulo de plataforma segura (TPM 2.0), certificados instalados de fábrica, sin contraseñas predeterminadas Autenticación de acceso obligatoria, cifrado HTTPS/TLS Fuente de alimentación PoE+ (802.3at tipo 2),', metadata={'nombre_pdf': 'avigilon-Datasheet-Bullet', 'modelo': 'Ava Bullet', 'proveedor': 'Avigilon', 'equipo': 'camara'}), Document(page_content='Interfaces compartidas 16 15 14 13 20 18 19 17 20 18 19 17 X1 X2 6 4 5 2 3 1 7 8 9 1U SOC4 / 480GB AC DUAL Características de hardware Especificaciones Nota: Todos los valores de rendimiento son “hasta” y varían según la configuración del sistema. 1 La prueba de rendimiento de VPN IPsec utiliza', metadata={'nombre_pdf': 'fortinet-fortigate-100f', 'modelo': '100F', 'proveedor': 'Fortinet', 'equipo': 'firewall'}), Document(page_content='de 1 Gigabit Ethernet RJ-45 (1000Base-T). Unidad óptica: DVD-RW. Gráficos: NVIDIA T1000 (8 GB).', metadata={'nombre_pdf': 'avigilon-rm7-wks-datasheet-es', 'modelo': 'RM7-WKS-2MN-EU', 'proveedor': 'Avigilon', 'equipo': 'workstation', 'tabla': True})]"
"Las características mínimas del Firewall redundado serán las siguientes: [LISTA] Firewall 20Gbps [LISTA] IPS 2.6 Gbps [LISTA] NGFW 1.6 Gbps; [LISTA] Threat Protection 1Gbps [LISTA] Sesiones concurrentes (TCP) 1.5 Million [LISTA] 2x GE RJ45 WAN Ports [LISTA] 2x GE RJ45 MGMT/DMZ Ports; [LISTA] 12x GE RJ45 [LISTA] 2x 10 GE SFP+ (equipado con los transceptores Sfp+ necesarios) [LISTA] 4x GE SFP (equipado con los transceptores Sfp necesarios) [LISTA] Fuente de alimentación redundante [LISTA] IPsec VPN throughput (512 byte) de 11.5 Gbps. [LISTA] Túneles IPSEC concurrentes: hasta 500. [LISTA] Conexiones HTTP concurrentes inspeccionadas: 18000. [LISTA] Capacidad evaluada para proteger contra evasiones, evasiones de HTTP y una combinación de técnicas de evasión. [LISTA] Gestión centralizada. [LISTA] Montaje en Rack. [LISTA] Temperatura de Operación: 0°C a 40°C. [LISTA] Humedad relativa 10-90% sin condensación. [LISTA] Normativa: FCC Part 15B, Class A, CE, RCM, VCCI, UL/cUL, CB, BSMI [LISTA] Certificaciones: USGv6/IPv6","- Nombre del equipo y proveedor: Fortinet 100F, Fortinet.
- Especificaciones que se han preguntado y aparecen en el contexto:
  - Firewall 20Gbps
  - IPS 2.6 Gbps
  - NGFW 1.6 Gbps
  - Threat Protection 1Gbps
  - Sesiones concurrentes (TCP) 1.5 Million
  - 2x GE RJ45 WAN Ports
  - 4x GE RJ45 MGMT/DMZ Ports
  - 12x GE RJ45
  - 2x 10 GE SFP+ (equipado con los transceptores Sfp+ necesarios)
  - Fuente de alimentación redundante
  - IPsec VPN throughput (512 byte) de 11.5 Gbps
  - Túneles IPSEC concurrentes: hasta 500
  - Conexiones HTTP concurrentes inspeccionadas: 18000
  - Capacidad evaluada para proteger contra evasiones, evasiones de HTTP y una combinación de técnicas de evasión
  - Gestión centralizada
  - Montaje en Rack
  - Temperatura de Operación: 0°C a 40°C
  - Humedad relativa 10-90% sin condensación
  - Normativa: FCC Part 15B, Class A, CE, RCM, VCCI, UL/cUL, CB, BSMI
  - Certificaciones: USGv6/IPv6","['Throughput de 2.6 Gbps, un NGFW Throughput de 1.6 Gbps y un Threat Protection Throughput de 1 Gbps.', 'redes de misión crítica. La serie FortiGate 100F ofrece fuentes de alimentación duales integradas no intercambiables en caliente. Seguridad de la capa de acceso USB HA1 12 11 10 9 8 7 6 5 4 3 1 ESTADO DE LA CONSOLA ALARMA HA POWER FortiGate 101F HA2 2 WAN 2 WAN 1 DMZ MGMT Interfaces compartidas 16', 'redundantes 4+1, CPU Intel Atom C3558 de 2.2GHz quad-core, almacenamiento flash de 32GB, SDRAM de 8GB, búfer de datos de 32MB, capacidad de conmutación máxima de 1.12 Tb/s, tasa de desvío de 833 Mpps, latencia <650 ns, consumo de energía de 91W (inactivo) / 209W (completa), disipación térmica de', 'MACSec de 256 bits para proteger el extremo de la red** [LISTA] Seguridad de imagen AOS firmada (a partir de AOS 8.9R4 y superior) [LISTA] Capacidad de arranque seguro y almacenamiento seguro** [LISTA] Calidad de servicio (QoS) avanzado y listas de control de acceso (ACL) para controlar el tráfico,', 'usuarios y dispositivos más allá de las técnicas de firewall tradicionales. IPS NGFW Threat Protection Interfaces FortiOS en todas partes FortiOS, el sistema operativo avanzado de Fortinet [LISTA] Visores interactivos de topología y desglose que muestran el estado en tiempo real Servicio', '/ 18 / 10 Gbps Latencia del firewall (64 bytes, UDP) 4,97 μs Rendimiento del firewall (paquetes por segundo) 15 Mpps Sesiones simultáneas (TCP) 1,5 millones de nuevas Sesiones/segundo (TCP) 56000 Políticas de firewall 10000 Rendimiento de VPN IPsec (512 bytes) 1 Túneles VPN IPsec de puerta de', 'de VPN IPsec utiliza AES256-SHA256. 2 IPS (Enterprise Mix), control de aplicaciones, NGFW y protección contra amenazas se miden con el registro habilitado. 3 Los valores de rendimiento de la inspección SSL utilizan un promedio de sesiones HTTPS de diferentes conjuntos de cifrado. Protección contra', '10 GE SFP+ FortiLink (predeterminadas), 2 puertos GE RJ45 WAN, 4 puertos compartidos GE RJ45 o SFP, 1 puerto USB, 1 puerto de consola, almacenamiento integrado de 0 x 480 GB SSD, 0 transceptores incluidos, rendimiento del sistema en mezcla de tráfico empresarial, un IPS Throughput de 2.6 Gbps, un']","El modelo de firewall escogido es FortiGate 100F de Fortinet. Tiene un rendimiento de firewall IPv4 de 20/18/10 Gbps. El rendimiento del sistema de prevención de intrusiones (IPS) es de 2.6 Gbps. Su rendimiento como firewall de nueva generación (NGFW) es de 1.6 Gbps. Rendimiento de protección de hilo (threat protection) de 1 Gbps. Sesiones concurrentes (TCP) 1.5 millones. Tiene 2 puertos GE RJ45 WAN. Tiene 1 puerto GE RJ45 DMZ y otro MGMT. En total tiene 22 puertos GE RJ45. Tiene 2x 10 GE SFP+. Tiene 4 ranuras GE SFP. Fuente de alimentación 100-240V AC, 50/60 Hz. IPsec VPN throughput (512 byte) de 11.5 Gbps. Túneles IPSEC concurrentes: hasta 2000 puerta a puerta y hasta 16000 cliente a puerta. Conexiones HTTP concurrentes inspeccionadas hasta 135000. Rendimiento medido de Threat Protection para Firewall, IPS, Application Control y Malware Protection. Tiene gestión centralizada. Incluye montaje en rack. Temperatura de operación de +0ºC a +40ºC. Humedad relativa del 10% al 90% sin condensación. Normativa: FCC Part 15B, Class A, CE, RCM, VCCI, UL/cUL, CB, BSMI. Cumple certificaciones USGv6/IPv6. ",Fortinet-117-firewall,firewall,,0.0,,0.9470762017126976,0.7285701367895633,0.7607954740524292,0.7302324771881104,0.7452006936073303,1,13,0.6190476190476191,"[Document(page_content='Throughput de 2.6 Gbps, un NGFW Throughput de 1.6 Gbps y un Threat Protection Throughput de 1 Gbps.', metadata={'nombre_pdf': 'fortinet-fortigate-100f', 'modelo': '100F', 'proveedor': 'Fortinet', 'equipo': 'firewall', 'tabla': True}), Document(page_content='redes de misión crítica. La serie FortiGate 100F ofrece fuentes de alimentación duales integradas no intercambiables en caliente. Seguridad de la capa de acceso USB HA1 12 11 10 9 8 7 6 5 4 3 1 ESTADO DE LA CONSOLA ALARMA HA POWER FortiGate 101F HA2 2 WAN 2 WAN 1 DMZ MGMT Interfaces compartidas 16', metadata={'nombre_pdf': 'fortinet-fortigate-100f', 'modelo': '100F', 'proveedor': 'Fortinet', 'equipo': 'firewall'}), Document(page_content='redundantes 4+1, CPU Intel Atom C3558 de 2.2GHz quad-core, almacenamiento flash de 32GB, SDRAM de 8GB, búfer de datos de 32MB, capacidad de conmutación máxima de 1.12 Tb/s, tasa de desvío de 833 Mpps, latencia <650 ns, consumo de energía de 91W (inactivo) / 209W (completa), disipación térmica de', metadata={'nombre_pdf': 'ale-omniswitch-6900-datasheet-es', 'modelo': '6900', 'proveedor': 'ALE', 'equipo': 'switch', 'tabla': True}), Document(page_content='MACSec de 256 bits para proteger el extremo de la red** [LISTA] Seguridad de imagen AOS firmada (a partir de AOS 8.9R4 y superior) [LISTA] Capacidad de arranque seguro y almacenamiento seguro** [LISTA] Calidad de servicio (QoS) avanzado y listas de control de acceso (ACL) para controlar el tráfico,', metadata={'nombre_pdf': 'ale-omniswitch-6570m-datasheet-es', 'modelo': '6570M', 'proveedor': 'ALE', 'equipo': 'switch'}), Document(page_content='usuarios y dispositivos más allá de las técnicas de firewall tradicionales. IPS NGFW Threat Protection Interfaces FortiOS en todas partes FortiOS, el sistema operativo avanzado de Fortinet [LISTA] Visores interactivos de topología y desglose que muestran el estado en tiempo real Servicio', metadata={'nombre_pdf': 'fortinet-fortigate-100f', 'modelo': '100F', 'proveedor': 'Fortinet', 'equipo': 'firewall'}), Document(page_content='/ 18 / 10 Gbps Latencia del firewall (64 bytes, UDP) 4,97 μs Rendimiento del firewall (paquetes por segundo) 15 Mpps Sesiones simultáneas (TCP) 1,5 millones de nuevas Sesiones/segundo (TCP) 56000 Políticas de firewall 10000 Rendimiento de VPN IPsec (512 bytes) 1 Túneles VPN IPsec de puerta de', metadata={'nombre_pdf': 'fortinet-fortigate-100f', 'modelo': '100F', 'proveedor': 'Fortinet', 'equipo': 'firewall'}), Document(page_content='de VPN IPsec utiliza AES256-SHA256. 2 IPS (Enterprise Mix), control de aplicaciones, NGFW y protección contra amenazas se miden con el registro habilitado. 3 Los valores de rendimiento de la inspección SSL utilizan un promedio de sesiones HTTPS de diferentes conjuntos de cifrado. Protección contra', metadata={'nombre_pdf': 'fortinet-fortigate-100f', 'modelo': '100F', 'proveedor': 'Fortinet', 'equipo': 'firewall'}), Document(page_content='10 GE SFP+ FortiLink (predeterminadas), 2 puertos GE RJ45 WAN, 4 puertos compartidos GE RJ45 o SFP, 1 puerto USB, 1 puerto de consola, almacenamiento integrado de 0 x 480 GB SSD, 0 transceptores incluidos, rendimiento del sistema en mezcla de tráfico empresarial, un IPS Throughput de 2.6 Gbps, un', metadata={'nombre_pdf': 'fortinet-fortigate-100f', 'modelo': '100F', 'proveedor': 'Fortinet', 'equipo': 'firewall', 'tabla': True})]"
"La cámara ofrecerá al menos las siguientes prestaciones y especificaciones mínimas: [LISTA] La óptica que incorpore será vari-focal con montura (C/CS) de manera que pueda adecuarse a diferentes escenarios y a variaciones o nuevas necesidades en el área de visualización de la cámara. [LISTA] Deberá permitir la retransmisión de flujo de video en tiempo real para su visualización desde el centro de control utilizando compresión H.264 o superior. [LISTA] Cámara digital IP. [LISTA] Resolución 5Mpx (2592x1944). [LISTA] Óptica vari-focal (12-36 mm) intercambiable con montura C/CS y enfoque motorizado. [LISTA] Filtro IR acoplado sobre óptica (removible físicamente del equipo). [LISTA] Iluminación mínima en blanco y negro de 0.03 lux. [LISTA] Tiempo mínimo de exposición 1/66500 seg. [LISTA] Control de iris de tipo P (P-iris). [LISTA] Estabilización electrónica de imagen (EIS). [LISTA] Frame rate configurable hasta 50fps. [LISTA] Tecnología WDR hasta 120dB. [LISTA] Flujo de video en MJPEG, H.264 y H.265. [LISTA] Funcionamiento multi-stream con al menos 3 stream simultáneos en distinto formato. [LISTA] Almacenamiento local vía tarjeta SD y remoto vía NAS. [LISTA] Conexión Ethernet por 10/100/1000baseT. [LISTA] Protocolo de comunicaciones ONVIF (perfiles M, S o T). [LISTA] Alimentación VDC, PoE (IEEE802.3af/at). [LISTA] Fabricado en material metálico. [LISTA] Certificado IP68 emitido por laboratorio externo certificado por ENAC. [LISTA] Certificado IK10 emitido por laboratorio externo certificado por ENAC.","- Nombre del equipo y proveedor: Bosch FLEXIDOME outdoor 5100i IR (NDE-5703-AL)
- Especificaciones que se han preguntado y aparecen en el contexto:
  - Cámara digital IP.
  - Resolución 5Mpx (2592x1944).
  - Óptica vari-focal (3,2mm - 10,5mm) intercambiable con montura C/CS.
  - Iluminación mínima en blanco y negro de 0.03 lux.
  - Frame rate configurable hasta 50fps.
  - Tecnología WDR.
  - Flujo de video en MJPEG, H.264 y H.265.
  - Funcionamiento multi-stream con al menos 3 stream simultáneos en distinto formato.
  - Almacenamiento local vía tarjeta SD.
  - Conexión Ethernet por 10/100/1000baseT.
  - Protocolo de comunicaciones ONVIF.
  - Alimentación PoE (IEEE802.3af/at).
  - Certificado IK10.","['de cámara/lente puede cumplir estos criterios: Cámara de 5MP con lente de 3,2mm - 10,5mm* DORI Definición de DORI Distancia 10,5mm/3,2m m Anchura horizontal Detección 25px/m (8px/pie) 48m/200m (147 pies/656 pies) 104m (341pies) Observación 63px/m (19px/pie) 19m/79m (62 pies/259 pies) 41m (135pies)', 'como IP66, NEMA 4X e IK10 y salvaguarda la cámara de la lluvia y el polvo, además de ofrecer protección contra el vandalismo y el sabotaje. preinstalado [LISTA] Posibilidad de crear automáticamente certificados exclusivos y autofirmados siempre que sea necesario [LISTA] Certificados de cliente y de', '30 ips, 3840 x 2160 (8,3 MP). [LISTA] Flujos de vídeo: Múltiples flujos configurables en H.264, H.265 y M-JPEG con velocidad de imágenes y ancho de banda personalizables. Regiones de interés (ROI) Bosch Intelligent Streaming. [LISTA] Latencia de la cámara: 120 ms (8 MP, 30 ips). [LISTA] Estructura', 'con un consumo general de 50W y un máximo de 80W. La cámara tiene un grado de protección IP67 e IK10, operando en un rango de temperatura de -40°C a +85°C, con una garantía de 3 años extensible. Sus dimensiones son 242x118x270mm y pesa 6 kg. Las dimensiones logísticas son 320x180x320mm y el peso', 'delanteras y traseras para mejorar la precisión LPR. \uf06e Especificación Cámara Máx. Resolución 2688 × 1520 Tipo de sensor CMOS de escaneo progresivo de 1/1,8"" Iluminación mínima Color: 0,0005 Lux a (F1.2, AGC ON) B/N: 0,0001 Lux a (F1.2, AGC ON) 0 Lux con obturador IR 1/30 s a 1/100 000 s Conmutador', 'imágenes IEC62676-5 HD SMPTE 296M-2001 (resolución: 1280x720) SMPTE 274M-2008 (resolución: 1920x1080) Representación de colores ITU-R BT.709-6 Cumplimiento de la normativa ONVIF EN50132-5-2, EN62676-2 Protección contra impactos EN 62262 (IK10) Normas Escriba Protección contra agua y polvo EN60529', 'SUPERFICIE MP WDR ANÁLISIS1 OBJETIVO IR IP66/IP67 HDSM SMARTCODEC 8.0C-H5A-FE-DO1 8,0 Ojo de pez de 1,4mm 8.0C-H5A-FE-DO1-IR 8,0 Ojo de pez de 1,4mm 12.0W-H5A-FE-DO1 12,0 Ojo de pez de 1,6mm 12.0W-H5A-FE-DO1-IR 12,0 Ojo de pez de 1,6mm 1 Los análisis pueden hacerse cuando la cámara se instala en el', 'PTZ (Pan-Tilt-Zoom) para una cobertura completa del área de vigilancia. Además, está equipada con tecnología de análisis de video avanzado para detectar y responder a eventos en tiempo real. La carcasa es robusta y resistente al agua y al polvo, cumpliendo con los estándares IP66 e IK10, lo que']","La cámara que mejor se ajusta es Neural Ghost AI de Neural Labs. Esta cámara tiene lentes varifocales. Tiene transmisión de video para su visualización desde el sistema central. No comenta si es una cámara IP. Puede escoger entre una opción con una resolución de 5 MP y otra con 8.9 MP. Ambas tienen óptica vari-focal de 11-50 mm o de 5.2-58.8 mm. Incluye filtro infrarrojo (IR) estroboscópico con 13 LEDS NIR a 850 nm. No habla sobre la iluminación mínima. No habla sobre el tiempo mínimo de exposición. Control de iris automático. No habla sobre la estabilización electrónica de imagen. Hasta 64 fps. No habla sobre la tecnología WDR. Flujo de video H.264 4K@55fps, H.265 4K@64fps. No habla sobre el comportamiento multi-stream. Permite almacenamiento local y remoto. Incluye un puerto Giga Ethernet con controlador. No habla sobre el protocolo de comunicaciones. Alimentación VDC. Fabricado en material metálico robusto. Incluye certificado IP67. Incluye certificado IK10. ",Neural_Labs-13-camara,camara,,0.0,,0.8802053720049772,0.5450649003759349,0.6823751330375671,0.6618436574935913,0.6719526052474976,0,2,0.1428571428571428,"[Document(page_content='de cámara/lente puede cumplir estos criterios: Cámara de 5MP con lente de 3,2mm - 10,5mm* DORI Definición de DORI Distancia 10,5mm/3,2m m Anchura horizontal Detección 25px/m (8px/pie) 48m/200m (147 pies/656 pies) 104m (341pies) Observación 63px/m (19px/pie) 19m/79m (62 pies/259 pies) 41m (135pies)', metadata={'nombre_pdf': 'bosch-NDE_5703_AL_Data_sheet_esES_98577430411', 'modelo': 'FLEXIDOME outdoor 5100i IR (NDE-5703-AL)', 'proveedor': 'Bosch', 'equipo': 'camara'}), Document(page_content='como IP66, NEMA 4X e IK10 y salvaguarda la cámara de la lluvia y el polvo, además de ofrecer protección contra el vandalismo y el sabotaje. preinstalado [LISTA] Posibilidad de crear automáticamente certificados exclusivos y autofirmados siempre que sea necesario [LISTA] Certificados de cliente y de', metadata={'nombre_pdf': 'bosch-NDE_5703_AL_Data_sheet_esES_98577430411', 'modelo': 'FLEXIDOME outdoor 5100i IR (NDE-5703-AL)', 'proveedor': 'Bosch', 'equipo': 'camara'}), Document(page_content='30 ips, 3840 x 2160 (8,3 MP). [LISTA] Flujos de vídeo: Múltiples flujos configurables en H.264, H.265 y M-JPEG con velocidad de imágenes y ancho de banda personalizables. Regiones de interés (ROI) Bosch Intelligent Streaming. [LISTA] Latencia de la cámara: 120 ms (8 MP, 30 ips). [LISTA] Estructura', metadata={'nombre_pdf': 'bosch-NDV_8504_R_Fixed_dom_Data_sheet_esES_87395344651', 'modelo': 'NDV-8504-R Domo fijo FLEXIDOME IP indoor 8000i', 'proveedor': 'Bosch', 'equipo': 'camara', 'tabla': True}), Document(page_content='con un consumo general de 50W y un máximo de 80W. La cámara tiene un grado de protección IP67 e IK10, operando en un rango de temperatura de -40°C a +85°C, con una garantía de 3 años extensible. Sus dimensiones son 242x118x270mm y pesa 6 kg. Las dimensiones logísticas son 320x180x320mm y el peso', metadata={'nombre_pdf': 'neurallabs-NL-GHOST-AI-ES-2024', 'modelo': 'NL Ghost AI', 'proveedor': 'Neural Labs', 'equipo': 'camara', 'tabla': True}), Document(page_content='delanteras y traseras para mejorar la precisión LPR. \uf06e Especificación Cámara Máx. Resolución 2688 × 1520 Tipo de sensor CMOS de escaneo progresivo de 1/1,8"" Iluminación mínima Color: 0,0005 Lux a (F1.2, AGC ON) B/N: 0,0001 Lux a (F1.2, AGC ON) 0 Lux con obturador IR 1/30 s a 1/100 000 s Conmutador', metadata={'nombre_pdf': 'hikvision-DS-TCG406-E_Datasheet_20230704', 'modelo': 'DS-TCG406-E', 'proveedor': 'HikVision', 'equipo': 'camara'}), Document(page_content='imágenes IEC62676-5 HD SMPTE 296M-2001 (resolución: 1280x720) SMPTE 274M-2008 (resolución: 1920x1080) Representación de colores ITU-R BT.709-6 Cumplimiento de la normativa ONVIF EN50132-5-2, EN62676-2 Protección contra impactos EN 62262 (IK10) Normas Escriba Protección contra agua y polvo EN60529', metadata={'nombre_pdf': 'bosch-NDV_8504_R_Fixed_dom_Data_sheet_esES_87395344651', 'modelo': 'NDV-8504-R Domo fijo FLEXIDOME IP indoor 8000i', 'proveedor': 'Bosch', 'equipo': 'camara'}), Document(page_content='SUPERFICIE MP WDR ANÁLISIS1 OBJETIVO IR IP66/IP67 HDSM SMARTCODEC 8.0C-H5A-FE-DO1 8,0 Ojo de pez de 1,4mm 8.0C-H5A-FE-DO1-IR 8,0 Ojo de pez de 1,4mm 12.0W-H5A-FE-DO1 12,0 Ojo de pez de 1,6mm 12.0W-H5A-FE-DO1-IR 12,0 Ojo de pez de 1,6mm 1 Los análisis pueden hacerse cuando la cámara se instala en el', metadata={'nombre_pdf': 'avigilon-h5a-fisheye-camera-datasheet-es', 'modelo': 'H5A FISHEYE', 'proveedor': 'Avigilon', 'equipo': 'camara'}), Document(page_content='PTZ (Pan-Tilt-Zoom) para una cobertura completa del área de vigilancia. Además, está equipada con tecnología de análisis de video avanzado para detectar y responder a eventos en tiempo real. La carcasa es robusta y resistente al agua y al polvo, cumpliendo con los estándares IP66 e IK10, lo que', metadata={'nombre_pdf': 'avigilon-h5a-rugged-ptz-camera-datasheet-es', 'modelo': 'H5A PTZ Resistente', 'proveedor': 'Avigilon', 'equipo': 'camara', 'tabla': True})]"
"La cámara de contexto ofrecerá al menos las siguientes prestaciones y especificaciones mínimas: [LISTA] La óptica que incorpore será de distancia focal fija intercambiable y con montura (C/CS) de manera que pueda elegirse en función de las características del punto de control. [LISTA] Deberá permitir la retransmisión de flujo de video en tiempo real para su visualización desde el centro de control. [LISTA] La cámara entregará una imagen de calidad suficiente que permita identificar los vehículos y leer (a vista de un humano) las matrículas de los vehículos ya sean convencionales, o especiales, las 24 horas del día y bajo cualquier condición de iluminación y meteorológica [LISTA] Cámara digital IP. [LISTA] Resolución 5Mpx (2592x1944). [LISTA] Óptica de distancia focal fija intercambiable con montura C/CS y enfoque motorizado. [LISTA] Iluminación mínima a color de 0.13 lux. [LISTA] Tiempo mínimo de exposición 1/66500 seg. [LISTA] Control de iris de tipo P (P-iris). [LISTA] Estabilización electrónica de imagen (EIS). [LISTA] Frame rate configurable hasta 50fps. [LISTA] Tecnología WDR hasta 120dB. [LISTA] Flujo de video en MJPEG, H.264 y H.265. [LISTA] Funcionamiento multi-stream con al menos 3 stream simultáneos en distinto formato. [LISTA] Almacenamiento local vía tarjeta SD y remoto vía NAS. [LISTA] Conexión Ethernet por RJ45 10/100/1000. [LISTA] Protocolo de comunicaciones ONVIF (perfiles G, M, S, T). [LISTA] Alimentación VDC, PoE (IEEE802.3af/at) [LISTA] Fabricado en material metálico. [LISTA] Certificado IP68 emitido por laboratorio externo certificado por ENAC. [LISTA] Certificado IK10 emitido por laboratorio externo certificado por ENAC.","- Nombre del equipo y proveedor: Bosch FLEXIDOME outdoor 5100i IR (NDE-5703-AL), Bosch.
- Especificaciones que se han preguntado y aparecen en el contexto:
  - Resolución: 5MP.
  - Tecnología WDR: No lo sé.
  - Flujo de video: No lo sé.
  - Funcionamiento multi-stream: No lo sé.
  - Almacenamiento local y remoto: No lo sé.
  - Conexión Ethernet: No lo sé.
  - Protocolo de comunicaciones: No lo sé.
  - Alimentación: No lo sé.
  - Material: No lo sé.
  - Certificado IP68: No lo sé.
  - Certificado IK10: No lo sé.","['trabajar de 15 a 35 metros de distancia. [LISTA] Captura de placa y entorno desde la misma unidad. [LISTA] 23 leds de iluminación para hasta 2 carriles (30 metros) a 850 nm. [LISTA] Montaje estándar IP 66. [LISTA] CPU de rango extendido de temperatura. [LISTA] Cámara de entorno ONVIF a color', '[TABLA] El modelo de cámara DS-TCG406-E de HikVision cuenta con protección IK10 (IEC 62262: 2002) y IP67 (IEC 60529-2013). En cuanto a la funcionalidad inteligente, presenta una tasa de captura superior al 98%, reconocimiento de la dirección de movimiento del vehículo con una precisión mayor al', 'de cámara/lente puede cumplir estos criterios: Cámara de 5MP con lente de 3,2mm - 10,5mm* DORI Definición de DORI Distancia 10,5mm/3,2m m Anchura horizontal Detección 25px/m (8px/pie) 48m/200m (147 pies/656 pies) 104m (341pies) Observación 63px/m (19px/pie) 19m/79m (62 pies/259 pies) 41m (135pies)', 'automóvil, motocicleta, bus, camión y furgoneta (Van o SUV) y, además, infracciones de tráfico. Incluye una cámara CMOS ultrasensible que puede ser de 3.2, 5 o 8.9 MP para lectura de matrículas y otra cámara a color CMOS de hasta 5MP para registro de evidencias. El cliente puede seleccionar el', 'de la cámara 120ms (8MP, 30ips) Estructura GOP IP Velocidad de fotogramas 1-30ips Relación señal/ruido (S/ R) >55dB Resolución de vídeo (HxV) Resoluciones compatibles Instalación de la cámara Imagen espejo Activado/desactivado Girar 0°/90° en vertical/180°/270° en vertical Posicionamiento', 'Especificaciones Alta resolución de video e imagen Imágenes más nítidas a 150 metros de distancia que posibilita ver en detalle la matrícula con múltiples opciones de zoom. Pantalla LCD transflectiva extra grande Su pantalla táctil de 9.4” permite la óptima visualización incluso bajo la luz solar.', 'Para la cámara de entorno, también hay tres opciones de sensores: Opción 1: 1080p 1/2’’ a color Rolling Shutter CMOS IMX385 con lentes de 11-50mm o 10-40mm (con zoom, foco y control del iris motorizados). Opción 2: 3.2 MP 1/1.8’’ a color Global Shutter CMOS IMX265 con lentes de 11-50mm o 10-40mm', 'Seguridad EN IEC 62368-1 IEC 62368-1 UL62368-1 IEC 62471 EN/IEC/UL 60950-22 Índice de protección frente a entrada EN 60529 (IP66) Rendimiento de imágenes IEC 62676-5 Representación de colores ITU-R BT.709-6 Cumplimiento de la normativa ONVIF EN 50132-5-2, EN 62676-2 Iluminación por infrarrojos IEC']","La cámara que mejor se ajusta es Neural Ghost AI de Neural Labs. Esta cámara tiene foco motorizado. Tiene transmisión de video para su visualización desde el sistema central. Puede leer matrículas las 24 horas del día bajo cualquier condición de iluminación y meteorológica. No comenta si es una cámara IP. Tiene una resolución de 5 MP. Con óptica vari-focal de 11-50 mm o de 10-40 mm. No habla sobre la iluminación mínima. No habla sobre el tiempo mínimo de exposición. Control de iris automático. No habla sobre la estabilización electrónica de imagen. Hasta 64 fps. No habla sobre la tecnología WDR. Flujo de video H.264 4K@55fps, H.265 4K@64fps. No habla sobre el comportamiento multi-stream. Permite almacenamiento local y remoto. Incluye un puerto Giga Ethernet con controlador. No habla sobre el protocolo de comunicaciones. Alimentación VDC. Fabricado en material metálico robusto. Incluye certificado IP67. Incluye certificado IK10. ",Neural_Labs-15-camara,camara,,1.0,,0.860423511178946,0.6054738315749832,0.6793280243873596,0.6180942058563232,0.6472660899162292,0,6,0.4285714285714285,"[Document(page_content='trabajar de 15 a 35 metros de distancia. [LISTA] Captura de placa y entorno desde la misma unidad. [LISTA] 23 leds de iluminación para hasta 2 carriles (30 metros) a 850 nm. [LISTA] Montaje estándar IP 66. [LISTA] CPU de rango extendido de temperatura. [LISTA] Cámara de entorno ONVIF a color', metadata={'nombre_pdf': 'neurallabs-NL-GHOST-OV-ES', 'modelo': 'NL Ghost OV', 'proveedor': 'Neural Labs', 'equipo': 'camara'}), Document(page_content='[TABLA] El modelo de cámara DS-TCG406-E de HikVision cuenta con protección IK10 (IEC 62262: 2002) y IP67 (IEC 60529-2013). En cuanto a la funcionalidad inteligente, presenta una tasa de captura superior al 98%, reconocimiento de la dirección de movimiento del vehículo con una precisión mayor al', metadata={'nombre_pdf': 'hikvision-DS-TCG406-E_Datasheet_20230704', 'modelo': 'DS-TCG406-E', 'proveedor': 'HikVision', 'equipo': 'camara', 'tabla': True}), Document(page_content='de cámara/lente puede cumplir estos criterios: Cámara de 5MP con lente de 3,2mm - 10,5mm* DORI Definición de DORI Distancia 10,5mm/3,2m m Anchura horizontal Detección 25px/m (8px/pie) 48m/200m (147 pies/656 pies) 104m (341pies) Observación 63px/m (19px/pie) 19m/79m (62 pies/259 pies) 41m (135pies)', metadata={'nombre_pdf': 'bosch-NDE_5703_AL_Data_sheet_esES_98577430411', 'modelo': 'FLEXIDOME outdoor 5100i IR (NDE-5703-AL)', 'proveedor': 'Bosch', 'equipo': 'camara'}), Document(page_content='automóvil, motocicleta, bus, camión y furgoneta (Van o SUV) y, además, infracciones de tráfico. Incluye una cámara CMOS ultrasensible que puede ser de 3.2, 5 o 8.9 MP para lectura de matrículas y otra cámara a color CMOS de hasta 5MP para registro de evidencias. El cliente puede seleccionar el', metadata={'nombre_pdf': 'neurallabs-NL-GHOST-AI-ES-2024', 'modelo': 'NL Ghost AI', 'proveedor': 'Neural Labs', 'equipo': 'camara'}), Document(page_content='de la cámara 120ms (8MP, 30ips) Estructura GOP IP Velocidad de fotogramas 1-30ips Relación señal/ruido (S/ R) >55dB Resolución de vídeo (HxV) Resoluciones compatibles Instalación de la cámara Imagen espejo Activado/desactivado Girar 0°/90° en vertical/180°/270° en vertical Posicionamiento', metadata={'nombre_pdf': 'bosch-FLEXIDOME_IP_starlig_Data_sheet_esES_68669614475', 'modelo': 'FLEXIDOME IP starlight 8000i - 8MP', 'proveedor': 'Bosch', 'equipo': 'camara'}), Document(page_content='Especificaciones Alta resolución de video e imagen Imágenes más nítidas a 150 metros de distancia que posibilita ver en detalle la matrícula con múltiples opciones de zoom. Pantalla LCD transflectiva extra grande Su pantalla táctil de 9.4” permite la óptima visualización incluso bajo la luz solar.', metadata={'nombre_pdf': 'tradesegur-TruCAMII_v5', 'modelo': 'Trucam II', 'proveedor': 'Tradegesur', 'equipo': 'cinemometro sancionador'}), Document(page_content='Para la cámara de entorno, también hay tres opciones de sensores: Opción 1: 1080p 1/2’’ a color Rolling Shutter CMOS IMX385 con lentes de 11-50mm o 10-40mm (con zoom, foco y control del iris motorizados). Opción 2: 3.2 MP 1/1.8’’ a color Global Shutter CMOS IMX265 con lentes de 11-50mm o 10-40mm', metadata={'nombre_pdf': 'neurallabs-NL-GHOST-AI-ES-2024', 'modelo': 'NL Ghost AI', 'proveedor': 'Neural Labs', 'equipo': 'camara', 'tabla': True}), Document(page_content='Seguridad EN IEC 62368-1 IEC 62368-1 UL62368-1 IEC 62471 EN/IEC/UL 60950-22 Índice de protección frente a entrada EN 60529 (IP66) Rendimiento de imágenes IEC 62676-5 Representación de colores ITU-R BT.709-6 Cumplimiento de la normativa ONVIF EN 50132-5-2, EN 62676-2 Iluminación por infrarrojos IEC', metadata={'nombre_pdf': 'bosch-FLEXIDOME_outdoor_31_Data_sheet_esES_121019031947', 'modelo': 'FLEXIDOME outdoor 3100i IR', 'proveedor': 'Bosch', 'equipo': 'camara'})]"
Los switches contarán con las siguientes especificaciones mínimas: [LISTA] 4 puertos 10/100/1000 Mbps PoE+. [LISTA] 2 puertos SFP 1 Gbps. [LISTA] Forwarding bandwidth: 6 Gbps. [LISTA] Accesorio carril DIN. [LISTA] Integración con Cisco ISE. [LISTA] Integración con autenticación TACACs.,"- Nombre del equipo y proveedor: Cisco Industrial Ethernet serie 1000, Cisco.
- Especificaciones que se han preguntado y aparecen en el contexto:
  - 2 puertos SFP 1 Gbps.
  - Integración con autenticación TACACs.","['Ethernet con o sin PoE+ y rendimiento a velocidad de línea [LISTA] Puertos de enlace ascendente Gigabit Ethernet SFP o puertos combo SFP/RJ-45, o puertos combo fijos 10 Gigabit Ethernet SFP+/RJ45 (modelos X) [LISTA] Chasis virtual de hasta 8 unidades (apilamiento) o 416 puertos, con un ancho de', 'presupuesto de PoE de 4. La potencia de entrada requerida es de 12-24V. Modelo Industrial Ethernet serie 1000 de Cisco, Product Number: IE-1000-6T2T-LM, tiene un total de 8 puertos. Incluye 2 puertos Fast Ethernet, 2 puertos GE SFP, y 6 puertos Fast Ethernet. Todos los 6 puertos Fast Ethernet son', '[TABLA] Modelo Industrial Ethernet serie 1000 de Cisco: Este modelo de switch utiliza transceptores SFP. Las especificaciones técnicas incluyen los siguientes transceptores: GLC-FE-100FX-RGD con un alcance de 2 km sobre MMF, GLC-LH-SM con un alcance de 550 m sobre MMF y 10 km sobre SMF, GLC-FE-100FX', 'de ALE: Este switch ofrece las mismas especificaciones que los modelos anteriores con 48 puertos SFP28 de 10/25G y 8 puertos QSFP28 de 40/100G, puertos QSFP28 que pueden funcionar como un solo puerto de 40/100GE o como cuatro puertos de 10/25GE, y puertos de administración de consola y Ethernet', 'PoE 100/1000/2500/5000 mbps multi-gigabit de 95W compatibles con IEEE 802.3 bt, cuatro puertos MACsec SFP28 (1G/10G/25G) y 2 puertos de enlace para chasis virtual QSFP28 de 100G. Todos los puertos PoE son compatibles con IEEE 802.3bt. Todos los puertos SFP28 de 25G son compatibles con MACSec de 256', 'máximo 5,6 Gbps Información detallada del producto Figura 1. Switches Cisco Industrial Ethernet serie 1000 Tabla 1. Configuraciones de los switchs Cisco IE 1000 Series Producto Número total de puertos Enlace ascendente de cobre Fast Ethernet Enlace ascendente GE SFP Voltaje de enlace descendente de', '1 GB de RAM y un búfer de paquetes de 16 Mb/s. La capacidad de conmutación ASIC es de 168 Gb/s y la capacidad de conmutación con todos los puertos es de 168 Gb/s. La velocidad de fotogramas del conmutador es de 125 Mpps y la capacidad VFL es de 40 Gb/s con 2x10GE. El consumo eléctrico es de 35.2 W', '[TABLA] Modelo OS6860E-24: Este modelo tiene 24 puertos RJ45 Gigabit y 4 enlaces 1/10G SFP+ con MACsec. Es compatible con las fuentes de alimentación OS6860-BP y OS6860-BP-D. No tiene capacidad PoE. Modelo OS6860E-P24: Dispone de 24 puertos Gigabit, de los cuales 20 son PoE+ y 4 son PoE de 60W,']",Se elige el switch Industrial Ethernet serie 1000 de Cisco. Tiene soporte hasta para 10 puertos de Ethernet. Tiene dos puertos SFP. Forwarding bandwidth máximo de 2.8 Gbps. Incluye carril DIN. Permite integración con Cisco. Integración con TACACS+. ,Cisco-17-switch,switch,,0.0,,0.9286928677383158,0.5654854911678919,0.6561617851257324,0.6865254640579224,0.6710003018379211,1,2,0.3333333333333333,"[Document(page_content='Ethernet con o sin PoE+ y rendimiento a velocidad de línea [LISTA] Puertos de enlace ascendente Gigabit Ethernet SFP o puertos combo SFP/RJ-45, o puertos combo fijos 10 Gigabit Ethernet SFP+/RJ45 (modelos X) [LISTA] Chasis virtual de hasta 8 unidades (apilamiento) o 416 puertos, con un ancho de', metadata={'nombre_pdf': 'ale-omniswitch-6360-datasheet-es', 'modelo': '6360', 'proveedor': 'ALE', 'equipo': 'switch'}), Document(page_content='presupuesto de PoE de 4. La potencia de entrada requerida es de 12-24V. Modelo Industrial Ethernet serie 1000 de Cisco, Product Number: IE-1000-6T2T-LM, tiene un total de 8 puertos. Incluye 2 puertos Fast Ethernet, 2 puertos GE SFP, y 6 puertos Fast Ethernet. Todos los 6 puertos Fast Ethernet son', metadata={'nombre_pdf': 'cisco-industrial_switch_eternet_1000', 'modelo': 'Industrial Ethernet serie 1000', 'proveedor': 'Cisco', 'equipo': 'switch', 'tabla': True}), Document(page_content='[TABLA] Modelo Industrial Ethernet serie 1000 de Cisco: Este modelo de switch utiliza transceptores SFP. Las especificaciones técnicas incluyen los siguientes transceptores: GLC-FE-100FX-RGD con un alcance de 2 km sobre MMF, GLC-LH-SM con un alcance de 550 m sobre MMF y 10 km sobre SMF, GLC-FE-100FX', metadata={'nombre_pdf': 'cisco-industrial_switch_eternet_1000', 'modelo': 'Industrial Ethernet serie 1000', 'proveedor': 'Cisco', 'equipo': 'switch', 'tabla': True}), Document(page_content='de ALE: Este switch ofrece las mismas especificaciones que los modelos anteriores con 48 puertos SFP28 de 10/25G y 8 puertos QSFP28 de 40/100G, puertos QSFP28 que pueden funcionar como un solo puerto de 40/100GE o como cuatro puertos de 10/25GE, y puertos de administración de consola y Ethernet', metadata={'nombre_pdf': 'ale-omniswitch-6900-datasheet-es', 'modelo': '6900', 'proveedor': 'ALE', 'equipo': 'switch', 'tabla': True}), Document(page_content='PoE 100/1000/2500/5000 mbps multi-gigabit de 95W compatibles con IEEE 802.3 bt, cuatro puertos MACsec SFP28 (1G/10G/25G) y 2 puertos de enlace para chasis virtual QSFP28 de 100G. Todos los puertos PoE son compatibles con IEEE 802.3bt. Todos los puertos SFP28 de 25G son compatibles con MACSec de 256', metadata={'nombre_pdf': 'ale-omniswitch-6860-datasheet-es', 'modelo': '6860N', 'proveedor': 'ALE', 'equipo': 'switch'}), Document(page_content='máximo 5,6 Gbps Información detallada del producto Figura 1. Switches Cisco Industrial Ethernet serie 1000 Tabla 1. Configuraciones de los switchs Cisco IE 1000 Series Producto Número total de puertos Enlace ascendente de cobre Fast Ethernet Enlace ascendente GE SFP Voltaje de enlace descendente de', metadata={'nombre_pdf': 'cisco-industrial_switch_eternet_1000', 'modelo': 'Industrial Ethernet serie 1000', 'proveedor': 'Cisco', 'equipo': 'switch'}), Document(page_content='1 GB de RAM y un búfer de paquetes de 16 Mb/s. La capacidad de conmutación ASIC es de 168 Gb/s y la capacidad de conmutación con todos los puertos es de 168 Gb/s. La velocidad de fotogramas del conmutador es de 125 Mpps y la capacidad VFL es de 40 Gb/s con 2x10GE. El consumo eléctrico es de 35.2 W', metadata={'nombre_pdf': 'ale-omniswitch-2360-row-version-datasheet-es', 'modelo': '2360', 'proveedor': 'ALE', 'equipo': 'switch', 'tabla': True}), Document(page_content='[TABLA] Modelo OS6860E-24: Este modelo tiene 24 puertos RJ45 Gigabit y 4 enlaces 1/10G SFP+ con MACsec. Es compatible con las fuentes de alimentación OS6860-BP y OS6860-BP-D. No tiene capacidad PoE. Modelo OS6860E-P24: Dispone de 24 puertos Gigabit, de los cuales 20 son PoE+ y 4 son PoE de 60W,', metadata={'nombre_pdf': 'ale-omniswitch-6860-datasheet-es', 'modelo': '6860N', 'proveedor': 'ALE', 'equipo': 'switch', 'tabla': True})]"
"Las cámaras de analítica de video contarán con las siguientes especificaciones mínimas: [LISTA] Protección ambiental: IP66. [LISTA] Protección frente a la corrosión: Nema-4X. [LISTA] Protección frente a impactos: IK10. [LISTA] Temperatura de funcionamiento continua desde -40ºC hasta +55ºC. [LISTA] Sensor: CMOS de 1/2,7"", resolución mínima de 5MP, 2688 (H) x 1944 (V) pixeles. [LISTA] Múltiples flujos de video: H.265, H.264, y M-JPEG. [LISTA] Iluminación mínima, medida según norma IEC 62676 Part 5: o Color: 0,06 lux. [SUBLISTA] Monocromo: 0,012 lux. [LISTA] Con infrarrojos activos: 0,0 lux, hasta 45m de distancia. [LISTA] Contraluces: Máximo: 120 dB. Medido según IEC 62676 parte 5: 105 dB. [LISTA] De 1 a 30 imágenes por segundo a 5MP. [LISTA] Lente varifocal de 3,2mm a 10,5mm, F1.6, con zoom y enfoque motorizados, control P-iris, y filtro IR conmutable de corte. [LISTA] Campo de visión: Gran angular: 96° x 71° (H x V); Tele: 29° x 22° (H x V). [LISTA] Protocolos de red: Pv4; IPv6; UDP; TCP; HTTP; HTTPS; RTP/RTCP; IGMP V2/V3; ICMP; ICMPv6; RTSP; FTP; ARP; DHCP; APIPA (Auto-IP, link local address); NTP (SNTP); SNMP (V1, MIBII); SNMP (V3, MIBII); 802.1x, EAP/TLS; DNS; DNSv6; DDNS; SMTP; iSCSI; UPnP (SSDP); DiffServ (QoS); LLDP; SOAP; CHAP; Digest authentication. [LISTA] Interoperatibilidad: ONVIF Perfil S, ONVIF Perfil G, ONVIF Perfil T, ONVIF Perfil M. [SUBLISTA] Coprocesador criptográfico (TPM): RSA 2048 bit; AES/CBC 256 bit; RSA 4096; ECDSA 256 bit. [SUBLISTA] PKI: Certificados X.509. [SUBLISTA] Encriptación: Cifrado completo de extremo a extremo con VMS compatible. [SUBLISTA] Red: TLS 1.2; AES 256; AES 128; TLS1.3. [SUBLISTA] Almacenamiento local: XTS-AES. [SUBLISTA] Autenticación de vídeo: Suma de comprobación, MD5, SHA-1, SHA-256. [LISTA] Certificación NDAA.","- Bosch DINION 5100i IR
  - Protección ambiental: IP66
  - Protección frente a la corrosión: Nema-4X
  - Protección frente a impactos: IK10
  - Interoperatibilidad: ONVIF

- Bosch DINION 7100i IR
  - Protección ambiental: IP66
  - Protección frente a impactos: IK10
  - Certificación NDAA

- Bosch FLEXIDOME outdoor 5100i IR (NDE-5703-AL)
  - Sensor: CMOS de 1/2,7"", resolución mínima de 5MP, 2688 (H) x 1944 (V) pixeles
  - Lente varifocal de 3,2mm a 10,5mm
  - Campo de visión: Gran angular: 96° x 71° (H x V); Tele: 29° x 22° (H x V)","['Cifrado completo de extremo a extremo con VMS compatible Red: TLS1.0/1.2, AES128, AES256 Almacenamiento local: XTS-AES Autenticación de vídeo Suma de comprobación, MD5, SHA-1, SHA-256 Especificaciones mecánicas Dimensiones (Pr.xAl.) 177x148 mm (6,97x5,83pulg.) Peso 2051,45g (4,52libras) Montaje', 'de cámara/lente puede cumplir estos criterios: Cámara de 5MP con lente de 3,2mm - 10,5mm* DORI Definición de DORI Distancia 10,5mm/3,2m m Anchura horizontal Detección 25px/m (8px/pie) 48m/200m (147 pies/656 pies) 104m (341pies) Observación 63px/m (19px/pie) 19m/79m (62 pies/259 pies) 41m (135pies)', 'IVA Pro Perimeter, IP67, IK10, H.265, IR, lente de 10,5-47mm Compatible con la norma NDAA Número de pedido NBE-7703-ALXT NBE-7704-AL Bullet 8MP HDR 4,4-10mm IP66/67 IK10 Cámara bullet fija de 8MP con starlight X, HDR, IVA Pro Buildings, IVA Pro Perimeter, IP67, IK10, H.265, IR, lente de 4,4-10mm', '30 ips, 3840 x 2160 (8,3 MP). [LISTA] Flujos de vídeo: Múltiples flujos configurables en H.264, H.265 y M-JPEG con velocidad de imágenes y ancho de banda personalizables. Regiones de interés (ROI) Bosch Intelligent Streaming. [LISTA] Latencia de la cámara: 120 ms (8 MP, 30 ips). [LISTA] Estructura', 'la norma IEC 62676-5. Para la protección contra impactos, se ajusta a la norma EN 62262 (IK10): 2002. Respecto al índice de protección frente a entrada, cumple con EN 60529 (IP66/67) y UL50E (NEMA tipo 4X). La cámara también es compatible con las normativas ONVIF según EN 50132-5-2 y EN 62676-2.', 'delanteras y traseras para mejorar la precisión LPR. \uf06e Especificación Cámara Máx. Resolución 2688 × 1520 Tipo de sensor CMOS de escaneo progresivo de 1/1,8"" Iluminación mínima Color: 0,0005 Lux a (F1.2, AGC ON) B/N: 0,0001 Lux a (F1.2, AGC ON) 0 Lux con obturador IR 1/30 s a 1/100 000 s Conmutador', 'CÁMARA H6 MINI DOME PEQUEÑA, PERO PODEROSA: HASTA 5MP 2MP 3MP 5MP 2 Opción de compra de la licencia de la cámara FIPS nivel 1 o del cifrado basado en hardware microSD CRYPTR, y de la gestión de claves para la asistencia y certificación FIPS nivel 3. Para más información, visite avigilon.com/h6m', 'y utiliza HDSM SmartCodec. Para el modelo 4.0C-H5A-RGDPTZ-DP36, tiene una resolución de 4.0 MP, tecnología WDR y LightCatcher, análisis en la posición de inicio, un objetivo de 4,4 [LISTA] 88 mm y zoom de 36x. También está clasificada con IP66/67/68 y utiliza HDSM SmartCodec. Para el modelo']","Se usa la cámara FLEXIDOME outdoor 5100i IR (NDE-5703-AL) de Bosch. Está calificado con protección ambiental IP66, protección frente a la corrosión Nema 4X y protección frente a impactos IK10. Temperatura de funcionamiento desde -40ºC hasta +55ºC. Tiene sensor CMOS de 1/2,7"", resolución mínima de 5MP, 2688 (H) x 1944 (V) pixeles. Múltiples flujos configurables en H.265; H.264 y M-JPEG. Iluminación mínima según la normativa IEC 62676 en color de 0.06 lx y monocromo de 0.012 lx. Con infrarrojos (IR) es de 0 lx hasta 45 m de distancia. Contraluz según normativa IEC 62676 parte 5. Hasta 30 fps (fotos por segundo). Lente varifocal de 3.2 a 10.5 mm, F1.6 con control P-iris y filtro de corte conmutable de IR. Campo de visión horizontal de 96º a 29º y vertical de 71º a 22º. Tiene protocolos de red IPv4; IPv6; UDP; TCP; HTTP; HTTPS; RTP/RTCP; IGMP V2/V3; ICMP; ICMPv6; RTSP; FTP; ARP; DHCP; APIPA (Auto-IP, link local address); NTP (SNTP); SNMP (V1, MIBII); SNMP (V3, MIBII); 802.1x, EAP/ TLS; DNS; DNSv6; DDNS (DynDNS.org, selfHOST.de, noip.com); SMTP; iSCSI; UPnP (SSDP); DiffServ (QoS); LLDP; SOAP; CHAP; Digest authentication. Acepta interoperatibilidad (conformidad) ONVIF Perfil S, ONVIF Perfil G, ONVIF Perfil T, ONVIF Perfil M y Auto-MDIX. Coprocesador criptográfico (TPM) RSA 2048 bit; AES/CBC 256 bit; RSA 4096; ECDSA de 256 bits. PKI Certificados X.509. Cifrado de extremo a extremo De extremo a extremo completo con VMS compatibles. Cifrado red TLS 1.2; AES 256; AES 128; TLS 1.3. Cifrado de almacenamiento local XTS-AES. Autenticación de vídeo MD5; SHA-1; SHA-256; y suma de comprobación. Compatible con certificado NDAA. ",Bosch-22-camara,camara,,0.0,,0.9379810678345232,0.5157452669586309,0.7454549074172974,0.5952800512313843,0.6619569659233093,1,11,0.4782608695652174,"[Document(page_content='Cifrado completo de extremo a extremo con VMS compatible Red: TLS1.0/1.2, AES128, AES256 Almacenamiento local: XTS-AES Autenticación de vídeo Suma de comprobación, MD5, SHA-1, SHA-256 Especificaciones mecánicas Dimensiones (Pr.xAl.) 177x148 mm (6,97x5,83pulg.) Peso 2051,45g (4,52libras) Montaje', metadata={'nombre_pdf': 'bosch-NDV_8504_R_Fixed_dom_Data_sheet_esES_87395344651', 'modelo': 'NDV-8504-R Domo fijo FLEXIDOME IP indoor 8000i', 'proveedor': 'Bosch', 'equipo': 'camara'}), Document(page_content='de cámara/lente puede cumplir estos criterios: Cámara de 5MP con lente de 3,2mm - 10,5mm* DORI Definición de DORI Distancia 10,5mm/3,2m m Anchura horizontal Detección 25px/m (8px/pie) 48m/200m (147 pies/656 pies) 104m (341pies) Observación 63px/m (19px/pie) 19m/79m (62 pies/259 pies) 41m (135pies)', metadata={'nombre_pdf': 'bosch-NDE_5703_AL_Data_sheet_esES_98577430411', 'modelo': 'FLEXIDOME outdoor 5100i IR (NDE-5703-AL)', 'proveedor': 'Bosch', 'equipo': 'camara'}), Document(page_content='IVA Pro Perimeter, IP67, IK10, H.265, IR, lente de 10,5-47mm Compatible con la norma NDAA Número de pedido NBE-7703-ALXT NBE-7704-AL Bullet 8MP HDR 4,4-10mm IP66/67 IK10 Cámara bullet fija de 8MP con starlight X, HDR, IVA Pro Buildings, IVA Pro Perimeter, IP67, IK10, H.265, IR, lente de 4,4-10mm', metadata={'nombre_pdf': 'bosch-DINION_7100i_IR_Data_Data_sheet_esES_118826844939', 'modelo': 'DINION 7100i IR', 'proveedor': 'Bosch', 'equipo': 'camara'}), Document(page_content='30 ips, 3840 x 2160 (8,3 MP). [LISTA] Flujos de vídeo: Múltiples flujos configurables en H.264, H.265 y M-JPEG con velocidad de imágenes y ancho de banda personalizables. Regiones de interés (ROI) Bosch Intelligent Streaming. [LISTA] Latencia de la cámara: 120 ms (8 MP, 30 ips). [LISTA] Estructura', metadata={'nombre_pdf': 'bosch-NDV_8504_R_Fixed_dom_Data_sheet_esES_87395344651', 'modelo': 'NDV-8504-R Domo fijo FLEXIDOME IP indoor 8000i', 'proveedor': 'Bosch', 'equipo': 'camara', 'tabla': True}), Document(page_content='la norma IEC 62676-5. Para la protección contra impactos, se ajusta a la norma EN 62262 (IK10): 2002. Respecto al índice de protección frente a entrada, cumple con EN 60529 (IP66/67) y UL50E (NEMA tipo 4X). La cámara también es compatible con las normativas ONVIF según EN 50132-5-2 y EN 62676-2.', metadata={'nombre_pdf': 'bosch-DINION_5100i_IR__Data_sheet_esES_105250134283', 'modelo': 'DINION 5100i IR', 'proveedor': 'Bosch', 'equipo': 'camara', 'tabla': True}), Document(page_content='delanteras y traseras para mejorar la precisión LPR. \uf06e Especificación Cámara Máx. Resolución 2688 × 1520 Tipo de sensor CMOS de escaneo progresivo de 1/1,8"" Iluminación mínima Color: 0,0005 Lux a (F1.2, AGC ON) B/N: 0,0001 Lux a (F1.2, AGC ON) 0 Lux con obturador IR 1/30 s a 1/100 000 s Conmutador', metadata={'nombre_pdf': 'hikvision-DS-TCG406-E_Datasheet_20230704', 'modelo': 'DS-TCG406-E', 'proveedor': 'HikVision', 'equipo': 'camara'}), Document(page_content='CÁMARA H6 MINI DOME PEQUEÑA, PERO PODEROSA: HASTA 5MP 2MP 3MP 5MP 2 Opción de compra de la licencia de la cámara FIPS nivel 1 o del cifrado basado en hardware microSD CRYPTR, y de la gestión de claves para la asistencia y certificación FIPS nivel 3. Para más información, visite avigilon.com/h6m', metadata={'nombre_pdf': 'avigilon-h6-mini-dome_fact-sheet_0222_ld_v4_es-LA', 'modelo': 'H6 Mini Dome', 'proveedor': 'Avigilon', 'equipo': 'camara'}), Document(page_content='y utiliza HDSM SmartCodec. Para el modelo 4.0C-H5A-RGDPTZ-DP36, tiene una resolución de 4.0 MP, tecnología WDR y LightCatcher, análisis en la posición de inicio, un objetivo de 4,4 [LISTA] 88 mm y zoom de 36x. También está clasificada con IP66/67/68 y utiliza HDSM SmartCodec. Para el modelo', metadata={'nombre_pdf': 'avigilon-h5a-rugged-ptz-camera-datasheet-es', 'modelo': 'H5A PTZ Resistente', 'proveedor': 'Avigilon', 'equipo': 'camara', 'tabla': True})]"
"Las especificaciones mínimas del radar serán las siguientes: [LISTA] Tecnología 4D/UHD. [LISTA] Antena tipo 132, para llegar a largo alcance y tener amplia cobertura angular horizontal. [LISTA] Capacidad multiobjetivo, con capacidad de detectar muchos reflectores dentro del campo de visión. [LISTA] Rastreo multiobjetivo: Posición (x,y), Velocidad absoluta, Ángulo de dirección, Longitud, ID [LISTA] Configurable la banda de frecuencias. [LISTA] Velocidad medible: o Largo alcance: 300 km/h. [SUBLISTA] Medio alcance: 255 km/h. [LISTA] Resistencia UV con certificado ISO. [LISTA] Altitud de transporte: 0- 1000m. [LISTA] Humedad relativa: 0-95%. [LISTA] Tiempo de inicialización < 10s.","- Nombre del equipo y proveedor: Evolis, Elancity.
- Especificaciones que se han preguntado y aparecen en el contexto:
  - Tecnología: No lo sé.
  - Antena tipo 132: No lo sé.
  - Capacidad multiobjetivo: No lo sé.
  - Rastreo multiobjetivo: No lo sé.
  - Configurable la banda de frecuencias: No lo sé.
  - Velocidad medible:
    - Largo alcance: 199 km/h.
    - Medio alcance: No lo sé.
  - Resistencia UV con certificado ISO: No lo sé.
  - Altitud de transporte: No lo sé.
  - Humedad relativa: No lo sé.
  - Tiempo de inicialización: No lo sé.","['[LISTA] Propiedades de detección: - Antena: Doppler 24,125Ghz / 5mV. - Apertura de la antena: Plano H 33° / Plano V 33°. - Rango elevado: 15 à 199 km/h. - Alcance: hasta 250 metros aproximadamente. - Precisión de la velocidad: +/- 1 km/h. [LISTA] Propiedades de visualización Manual de instrucciones', 'por ejemplo, esto puede provocar una reducción de la batería. capacidad, menor rendimiento del radar o reinicios aleatorios Figura 3.1.1: Dimensiones del gabinete abovedado El sensor de radar realiza un proceso de recalibración periódicamente para brindar la medición más precisa. Es una función', 'm (313 pies/1525 pies) y una anchura horizontal de 77 m (240 pies). Para la observación, la definición de DORI es de 63 px/m (19 px/pie) con una distancia de 10,5 mm/47 m, y una distancia máxima de 40 m/194 m (132 pies/642 pies) y una anchura horizontal de 31 m (101 pies). Para el reconocimiento,', 'alcance del radar 20 cm (no debe cambiarse) Longitud del alcance del radar 60 cm (no debe cambiarse) cambiarse) Umbral de radar 30 (no debe cambiarse) Modo de unión LoRaWAN 1 (OTAA) LoRaWAN DevEUI valor predeterminado de fábrica único LoRaWAN DevAddr, valor predeterminado de fábrica único LoRaWAN', 'los máximos niveles de precisión para aplicaciones de naturaleza crítica, como la protección perimetral de aeropuertos, infraestructuras críticas y edificios gubernamentales, patrulla de fronteras, seguimiento de embarcaciones y control del tráfico (por ejemplo, detección de circulación en sentido', 'continua las 24 horas, el montaje del TruCAM II en Cabina Lite es su mejor opción. Sus mínimas dimensiones le facilita su instalación sobre un poste u otro elemento urbano. Adicionalmente puede dotar de nuevas funcionalidades a su radar incorporando tecnología ALPR para lectura de matrículas y', 'velocidad, dirección, color y clases de objeto (6). La cámara permite seguimiento perimetral 3D, incluyendo seguimiento de barcos, modo Museo, seguimiento perimetral (2D), seguimiento de personas (3D), seguimiento básico (2D) y seguimiento del tráfico (3D). La calibración es automática basada en el', 'avanzada consigue imágenes de más calidad y a mayor distancia. Su conectividad con otros dispositivos permite seguir la operativa en remoto. [LISTA] Alcance máximo de 1.200 metros [LISTA] Imágenes más nítidas a 150 metros de distancia [LISTA] Máxima versatilidad con diferentes tipos de operativa:']","Se elige el radar QX-33-TC-RAD de QUADREX. No habla sobre la tecnología 4D/UHD ni sobre el tipo de antena. Tiene capacidad multiobjetivo con captura de velocidad, número de vehículos, clase de vehículo, dirección y espacio entre vehículos. No habla sobre la banda de frecuencias. Velocidad medible hasta 255 km/h. No habla sobre la resistencia UV. No habla sobre la altitud de transporte. No habla sobre la humedad relativa. No habla sobre el tiempo de inicialización. ",QUADREX-23-radar_aforador,radar aforador,,0.0,,0.8489398104144152,0.3193778097464609,0.6881672143936157,0.7027137279510498,0.6953644156455994,0,4,1.0,"[Document(page_content='[LISTA] Propiedades de detección: - Antena: Doppler 24,125Ghz / 5mV. - Apertura de la antena: Plano H 33° / Plano V 33°. - Rango elevado: 15 à 199 km/h. - Alcance: hasta 250 metros aproximadamente. - Precisión de la velocidad: +/- 1 km/h. [LISTA] Propiedades de visualización Manual de instrucciones', metadata={'nombre_pdf': 'elancity-radar-pedagogico-evolis', 'modelo': 'Evolis', 'proveedor': 'Elancity', 'equipo': 'radar pedagogico'}), Document(page_content='por ejemplo, esto puede provocar una reducción de la batería. capacidad, menor rendimiento del radar o reinicios aleatorios Figura 3.1.1: Dimensiones del gabinete abovedado El sensor de radar realiza un proceso de recalibración periódicamente para brindar la medición más precisa. Es una función', metadata={'nombre_pdf': 'libelium-Smart_Parking_Technical_Guide', 'modelo': 'Cabina Smart Spot, Smart Parking Node', 'proveedor': 'Libelium', 'equipo': 'smart parking node'}), Document(page_content='m (313 pies/1525 pies) y una anchura horizontal de 77 m (240 pies). Para la observación, la definición de DORI es de 63 px/m (19 px/pie) con una distancia de 10,5 mm/47 m, y una distancia máxima de 40 m/194 m (132 pies/642 pies) y una anchura horizontal de 31 m (101 pies). Para el reconocimiento,', metadata={'nombre_pdf': 'bosch-DINION_7100i_IR_Data_Data_sheet_esES_118826844939', 'modelo': 'DINION 7100i IR', 'proveedor': 'Bosch', 'equipo': 'camara', 'tabla': True}), Document(page_content='alcance del radar 20 cm (no debe cambiarse) Longitud del alcance del radar 60 cm (no debe cambiarse) cambiarse) Umbral de radar 30 (no debe cambiarse) Modo de unión LoRaWAN 1 (OTAA) LoRaWAN DevEUI valor predeterminado de fábrica único LoRaWAN DevAddr, valor predeterminado de fábrica único LoRaWAN', metadata={'nombre_pdf': 'libelium-Smart_Parking_Technical_Guide', 'modelo': 'Cabina Smart Spot, Smart Parking Node', 'proveedor': 'Libelium', 'equipo': 'smart parking node'}), Document(page_content='los máximos niveles de precisión para aplicaciones de naturaleza crítica, como la protección perimetral de aeropuertos, infraestructuras críticas y edificios gubernamentales, patrulla de fronteras, seguimiento de embarcaciones y control del tráfico (por ejemplo, detección de circulación en sentido', metadata={'nombre_pdf': 'bosch-FLEXIDOME_IP_starlig_Data_sheet_esES_68669614475', 'modelo': 'FLEXIDOME IP starlight 8000i - 8MP', 'proveedor': 'Bosch', 'equipo': 'camara'}), Document(page_content='continua las 24 horas, el montaje del TruCAM II en Cabina Lite es su mejor opción. Sus mínimas dimensiones le facilita su instalación sobre un poste u otro elemento urbano. Adicionalmente puede dotar de nuevas funcionalidades a su radar incorporando tecnología ALPR para lectura de matrículas y', metadata={'nombre_pdf': 'tradesegur-cabina-lite-trucamii', 'modelo': 'Cabina Lite de Trucam II', 'proveedor': 'Tradegesur', 'equipo': 'cinemometro sancionador'}), Document(page_content='velocidad, dirección, color y clases de objeto (6). La cámara permite seguimiento perimetral 3D, incluyendo seguimiento de barcos, modo Museo, seguimiento perimetral (2D), seguimiento de personas (3D), seguimiento básico (2D) y seguimiento del tráfico (3D). La calibración es automática basada en el', metadata={'nombre_pdf': 'bosch-DINION_7100i_IR_Data_Data_sheet_esES_118826844939', 'modelo': 'DINION 7100i IR', 'proveedor': 'Bosch', 'equipo': 'camara', 'tabla': True}), Document(page_content='avanzada consigue imágenes de más calidad y a mayor distancia. Su conectividad con otros dispositivos permite seguir la operativa en remoto. [LISTA] Alcance máximo de 1.200 metros [LISTA] Imágenes más nítidas a 150 metros de distancia [LISTA] Máxima versatilidad con diferentes tipos de operativa:', metadata={'nombre_pdf': 'tradesegur-cabina-lite-trucamii', 'modelo': 'Cabina Lite de Trucam II', 'proveedor': 'Tradegesur', 'equipo': 'cinemometro sancionador'})]"
"Las características que ofrecerá los sensores de medición de ruido son: 1. Sensor con precisión clase 1 según IEC 61672-1: o Detector: Nivel de presión sonora continuo equivalente y nivel de presión sonora con ponderación temporal rápida (Fast) y lenta (Slow). [LISTA] Ponderación Frecuencial: A y C. [LISTA] Funciones Acústicas Medidas: Niveles equivalentes con ponderación frecuencial A y C con tiempo programable entre 1s y 60min: LAeqT y LCeqT. Niveles máximos con ponderación temporal rápida y slow sobre un tiempo programable entre 1s y 60min y ponderación frecuencial A: LAFmaxT y LASmaxT. [LISTA] Resolución 0,1 dB. [LISTA] Precisión según IEC 61672-1: clase 1. [LISTA] Margen de medición sin escalas: de 28 a 120 dBA. [LISTA] Margen de linealidad a 1kHz : de 35 a 120 dBA. 2. Protección contra agentes externos con kit de exterior: viento, lluvia, pájaros. Mantiene clase 1. Protección IP65. 3. Capacidad de integración a una plataforma de monitorización de ruido, de código abierto o Propietarias. 4. Dimensiones reducidas y fácil de instalar en farolas, luminarias, marquesinas, MUPIs, OPIs, vallas y postes publicitarios. 5. Alimentación de energía, a través la red eléctrica, baterías externas, paneles solares o POE (Power Over Ethernet). 6. Medición continua 24 horas/7 días a la semana. 7. Red sin límite en el número de sensores. 8. Comunicación por Ethernet RJ45, Wi-Fi, Modem. 9. Configuración remota del sensor, sin necesidad de tener dirigirse hasta el lugar.","- Nombre del equipo y proveedor: CESVA Clase 1 modelo TA120
- Especificaciones:
  - Sensor con precisión clase 1 según IEC 61672-1.
  - Detector: Nivel de presión sonora continuo equivalente y nivel de presión sonora con ponderación temporal rápida (Fast) y lenta (Slow).
  - Ponderación Frecuencial: A y C.
  - Funciones Acústicas Medidas: Niveles equivalentes con ponderación frecuencial A y C con tiempo programable entre 1s y 60min: LAeqT y LCeqT. Niveles máximos con ponderación temporal rápida y slow sobre un tiempo programable entre 1s y 60min y ponderación frecuencial A: LAFmaxT y LASmaxT.
  - Resolución 0,1 dB.
  - Precisión según IEC 61672-1: clase 1.
  - Protección contra agentes externos con kit de exterior: viento, lluvia, pájaros. Mantiene clase 1. Protección IP65.
  - Completamente integrable en diferentes plataformas: Noise-Platform (CESVA), de código abierto como Sentilo.
  - Dimensiones reducidas y fácil de instalar en farolas, luminarias, marquesinas, MUPIs, OPIs, vallas y postes publicitarios.
  - Alimentación de energía, a través la red eléctrica, baterías externas, paneles solares o POE (Power Over Ethernet).
  - Medición continua 24 horas/7 días a la semana.
  - Comunicación por Ethernet RJ45, Wi-Fi, Modem.
  - Configuración remota del sensor, sin necesidad de tener dirigirse hasta el lugar.

- Nombre del equipo y proveedor: HBK B&K 2245
- Especificaciones:
  - Sensor con precisión clase 1 según IEC 61672-1.
  - Rango dinámico, rango de linealidad: Para una señal de tono puro de 1 kHz, con ponderación A: de 23.2 a 140.3 dB.
  - Conexiones: USB-C, Ethernet a través de USB.
  - Velocidad de datos: 150 Mbps.
  - Cifrado/Autenticación: TLS, SSL.","['[LISTA] Sensor con precisión clase 1 según IEC 61672-1. [LISTA] Protección contra agentes externos con kit de exterior: viento, lluvia, pájaros. Mantiene clase 1. Protección IP65. [LISTA] Completamente integrable en diferentes plataformas: Noise- Platform (CESVA), de código abierto como Sentilo o', 'A: de 21.9 a 123.0 dB. Rango dinámico, rango de linealidad: Para una señal de tono puro de 1 kHz, con ponderación A: de 23.2 a 140.3 dB, de acuerdo con IEC 60804: con ponderación A: de 19.8 a 141.5 dB. Rango dinámico, rango de operación lineal: Para una señal de tono puro de 1 kHz, con ponderación', 'D_TA120_v0016_20240228_ES APLICACIONES DETECTOR: Nivel de presión sonora continuo equivalente y nivel de presión sonora con ponderación temporal rápida (Fast) y lenta (Slow) PONDERACIÓN FRECUENCIAL: A y C FUNCIÓNES ACÚSTICAS MEDIDAS: Niveles equivalentes con ponderación frecuencial A y C con tiempo', 'y conectar sonómetros, permitiendo conexiones más sencillas por wifi, etc. No se utiliza para transporte para transferir datos de medición o audio CONEXIONES USB-C, Ethernet a través de USB VELOCIDAD DE DATOS 150 Mbps CIFRADO/ AUTENTICACIÓN TLS, SSL MODOS DE MEDICIÓN Único AJUSTE LIBRE Medición', '[TABLA] El modelo B&K 2245 es un sonómetro proporcionado por HBK. Cumple con varias normas técnicas internacionales y estadounidenses. De acuerdo con la IEC – International Electrotechnical Commission, cumple con la norma IEC 61260:1995-07 (incluyendo la Enmienda 1 de 2001-09) para bandas de', 'CARACTERÍSTICAS PRINCIPALES El ruido se ha convertido en un vector imprescindible a la hora de sensorizar una ciudad inteligente. Los más de 45 años de experiencia de CESVA en el diseño y fabricación de sonómetros se concentran en el sensor para medición de ruido TA120. El TA120 reúne en un equipo', 'proporciona una solución completa para una tarea específica. La medición, el análisis y la documentación precisos del ruido nunca han sido tan sencillos. Usos y características Usos [LISTA] Mediciones de ruido que requieren instrumentación compatible con IEC 61672 [LISTA] Inspección de ruido de', 'Noise Partner (BZ-7304). Los parámetros instantáneos disponibles solo para visualización incluyen L XY, L XY(SPL), y L Xpeak,1s, todos compatibles con las cinco licencias mencionadas. Para visualización y almacenamiento, el sonómetro soporta los parámetros Totals, Logging, L XYmax, L XYmin, L']","Como sensor de ruido se puede elegir el equipo Clase 1 modelo TA120 de CESVA. Tiene PRECISIÓN según IEC 61672-1: clase 1. Un DETECTOR: Nivel de presión sonora continuo equivalente y nivel de presión sonora con ponderación temporal rápida (Fast) y lenta (Slow). Ponderación Frecuencial: A y C. Funciones Acústicas Medidas: Niveles equivalentes con ponderación frecuencial A y C con tiempo programable entre 1s y 60min: LAeqT y LCeqT. Niveles máximos con ponderación temporal rápida y slow sobre un tiempo programable entre 1s y 60min y ponderación frecuencial A: LAFmaxT y LASmaxT. Resolución 0,1 dB. Margen de linealidad a 1kHz de 35 a 120 dBA. Grado de protección IP65. Completamente integrable en diferentes plataformas. Tiene dimensiones reducidas. Alimentación por red eléctrica con respaldo de batería B120, POE (Power over Ethernet), 12 VDC (Paneles solares, baterías externas). Medición continua 24 horas/7 días a la semana. Red sin límite en el número de sensores. Comunicación por Ethernet (RJ45), Wi-Fi, Módem 2G/GPRS o 3G, bucle de corriente 4-20 mA. Configuración remota del sensor Actualización automática de firmware (vía OTA). ",CESVA-24-sonometro,sonometro,,0.217391304347826,,0.9508394266046168,0.7091384280797256,0.7863799929618835,0.8372073769569397,0.8109980821609497,1,13,0.8125,"[Document(page_content='[LISTA] Sensor con precisión clase 1 según IEC 61672-1. [LISTA] Protección contra agentes externos con kit de exterior: viento, lluvia, pájaros. Mantiene clase 1. Protección IP65. [LISTA] Completamente integrable en diferentes plataformas: Noise- Platform (CESVA), de código abierto como Sentilo o', metadata={'nombre_pdf': 'cesva-ta120', 'modelo': 'Clase 1 modelo TA120', 'proveedor': 'CESVA', 'equipo': 'sonometro'}), Document(page_content='A: de 21.9 a 123.0 dB. Rango dinámico, rango de linealidad: Para una señal de tono puro de 1 kHz, con ponderación A: de 23.2 a 140.3 dB, de acuerdo con IEC 60804: con ponderación A: de 19.8 a 141.5 dB. Rango dinámico, rango de operación lineal: Para una señal de tono puro de 1 kHz, con ponderación', metadata={'nombre_pdf': 'hbk-bk-2245-Data_Sheet', 'modelo': 'B&K 2245', 'proveedor': 'HBK', 'equipo': 'sonometro', 'tabla': True}), Document(page_content='D_TA120_v0016_20240228_ES APLICACIONES DETECTOR: Nivel de presión sonora continuo equivalente y nivel de presión sonora con ponderación temporal rápida (Fast) y lenta (Slow) PONDERACIÓN FRECUENCIAL: A y C FUNCIÓNES ACÚSTICAS MEDIDAS: Niveles equivalentes con ponderación frecuencial A y C con tiempo', metadata={'nombre_pdf': 'cesva-ta120', 'modelo': 'Clase 1 modelo TA120', 'proveedor': 'CESVA', 'equipo': 'sonometro'}), Document(page_content='y conectar sonómetros, permitiendo conexiones más sencillas por wifi, etc. No se utiliza para transporte para transferir datos de medición o audio CONEXIONES USB-C, Ethernet a través de USB VELOCIDAD DE DATOS 150 Mbps CIFRADO/ AUTENTICACIÓN TLS, SSL MODOS DE MEDICIÓN Único AJUSTE LIBRE Medición', metadata={'nombre_pdf': 'hbk-bk-2245_2255-BZ-7300-Data_Sheet', 'modelo': 'B&K 2245', 'proveedor': 'HBK', 'equipo': 'sonometro'}), Document(page_content='[TABLA] El modelo B&K 2245 es un sonómetro proporcionado por HBK. Cumple con varias normas técnicas internacionales y estadounidenses. De acuerdo con la IEC – International Electrotechnical Commission, cumple con la norma IEC 61260:1995-07 (incluyendo la Enmienda 1 de 2001-09) para bandas de', metadata={'nombre_pdf': 'hbk-bk-2245-Data_Sheet', 'modelo': 'B&K 2245', 'proveedor': 'HBK', 'equipo': 'sonometro', 'tabla': True}), Document(page_content='CARACTERÍSTICAS PRINCIPALES El ruido se ha convertido en un vector imprescindible a la hora de sensorizar una ciudad inteligente. Los más de 45 años de experiencia de CESVA en el diseño y fabricación de sonómetros se concentran en el sensor para medición de ruido TA120. El TA120 reúne en un equipo', metadata={'nombre_pdf': 'cesva-ta120', 'modelo': 'Clase 1 modelo TA120', 'proveedor': 'CESVA', 'equipo': 'sonometro'}), Document(page_content='proporciona una solución completa para una tarea específica. La medición, el análisis y la documentación precisos del ruido nunca han sido tan sencillos. Usos y características Usos [LISTA] Mediciones de ruido que requieren instrumentación compatible con IEC 61672 [LISTA] Inspección de ruido de', metadata={'nombre_pdf': 'hbk-bk-2245-Data_Sheet', 'modelo': 'B&K 2245', 'proveedor': 'HBK', 'equipo': 'sonometro'}), Document(page_content='Noise Partner (BZ-7304). Los parámetros instantáneos disponibles solo para visualización incluyen L XY, L XY(SPL), y L Xpeak,1s, todos compatibles con las cinco licencias mencionadas. Para visualización y almacenamiento, el sonómetro soporta los parámetros Totals, Logging, L XYmax, L XYmin, L', metadata={'nombre_pdf': 'hbk-bk-2245-Data_Sheet', 'modelo': 'B&K 2245', 'proveedor': 'HBK', 'equipo': 'sonometro', 'tabla': True})]"
El equipo SAI contará al menos con las siguientes características: [LISTA] 2KVA de potencia. [LISTA] Funcionamiento on-line de doble conversión. [LISTA] Factor de potencia en salida de 0.9. [LISTA] Amplio margen de tensión de entrada. [LISTA] Bypass electrónico integrado. [LISTA] Dos salidas independientes programables para ahorro de autonomía. [LISTA] Eficiencia superior al 93% AC-AC. [LISTA] Autonomía mínima de 12 horas.,"- Nombre del equipo y proveedor: Sentinel Rack de RIELLO.
- Especificaciones:
  - Potencia: 2KVA.
  - Funcionamiento: On-line de doble conversión.
  - Factor de potencia en salida: 0.9.
  - Amplio margen de tensión de entrada.
  - Bypass electrónico integrado.
  - Eficiencia: No lo sé.
  - Autonomía mínima: No lo sé.
  - Dos salidas independientes programables para ahorro de autonomía: No lo sé.","['los ventiladores basado en la carga, el ruido que genera el SAI es de menos de 40 dBA. CARACTERÍSTICAS [LISTA] Tensión fiable, filtrada y estabilizada: tecnología Double Conversion ON LINE (VFI que cumple con IEC 62040-3), con filtros para la supresión de perturbaciones atmosféricas [LISTA] Alta', 'Otros componentes de software mencionados son MULTIC y OM 302. Estas características indican una amplia gama de opciones de gestión y monitoreo para el SAI.', '3:1. Los modos de eficiencia ECO y SMART ACTIVE alcanzan un 98 %. Las baterías son VRLA AGM a base de plomo sin mantenimiento, con un tiempo de carga de 2-4 h. El peso neto es de 14 kg (sin baterías) y el bruto de 18 kg. Las dimensiones son 450x380x87 mm (19”x380x2U) y el embalaje es de 540x490x190', '[TABLA] Modelo Sentinel Rack de RIELLO: Este modelo de SAI está diseñado para aplicaciones críticas. Su capacidad de potencia varía entre 1.5 kVA y 10 kVA. Utiliza tecnología On-line doble conversión, garantizando una protección eléctrica máxima. Incorpora un factor de potencia de salida de 0.9, lo', 'amplio rango de tolerancia de tensión de entrada ayuda a reducir el uso de la batería y a mantener las prestaciones a lo largo del tiempo. EXPANSIBILIDAD DEL TIEMPO DE FUNCIONAMIENTO (SER 3000) Se pueden conectar módulos de extensión de batería para aumentar el tiempo de funcionamiento del SAI. La', 'del sistema. [LISTA] Diseño de doble entrada, que permite diferentes fuentes de suministro de energía para una mayor disponibilidad. [LISTA] Bypass manual incorporado para garantizar energía continua a la carga, incluso si el UPS falla ó se encuentra en labores de mantenimiento. Costo total de', 'HIGHLIGHTS [LISTA] Factor de potencia 0.9 [LISTA] Funcionamiento flexible [LISTA] Función de emergencia [LISTA] Optimización de batería [LISTA] Expansibilidad del tiempo de funcionamiento [LISTA] Diseño compacto [LISTA] Profundidad del rack de 380 mm Sentinel Rack DIGITAL LIVING E-MEDICAL EMERGENCY', 'atmosféricas [LISTA] Alta capacidad de sobrecarga (hasta 150%) [LISTA] Auto restart programable al restablecerse la red [LISTA] Activación por batería (Cold Start) [LISTA] Corrección del factor de potencia (factor de potencia de entrada del SAI, aprox. 1) [LISTA] Amplio rango de tolerancia de']",El SAI escogido es Sentinel Rack de RIELLO. Se escoge el modelo SER 3000 ER al tener 3KVA de potencia. Emplea tecnología de doble conversión. Su factor de potencia es 0.9. Tiene un amplio margen de tensión de entrada (de 140V a 276V). Tiene bypass integrado. Tiene 8 tomas de salida IEC 320 C13 (10 A) y una toma IEC 320 C19 (16 A). Eficiencia del 98% en el modo ECO y SMART ACTIVE. No habla sobre la autonomía del SAI. ,RIELLO-29-sai,sai,,0.0,,0.922029982747216,0.380507495686804,0.7137585282325745,0.6601337790489197,0.6858996152877808,1,2,0.2857142857142857,"[Document(page_content='los ventiladores basado en la carga, el ruido que genera el SAI es de menos de 40 dBA. CARACTERÍSTICAS [LISTA] Tensión fiable, filtrada y estabilizada: tecnología Double Conversion ON LINE (VFI que cumple con IEC 62040-3), con filtros para la supresión de perturbaciones atmosféricas [LISTA] Alta', metadata={'nombre_pdf': 'riello-sentinelrack', 'modelo': 'Sentinel Rack', 'proveedor': 'RIELLO', 'equipo': 'sai'}), Document(page_content='Otros componentes de software mencionados son MULTIC y OM 302. Estas características indican una amplia gama de opciones de gestión y monitoreo para el SAI.', metadata={'nombre_pdf': 'riello-sentinelrack', 'modelo': 'Sentinel Rack', 'proveedor': 'RIELLO', 'equipo': 'sai', 'tabla': True}), Document(page_content='3:1. Los modos de eficiencia ECO y SMART ACTIVE alcanzan un 98 %. Las baterías son VRLA AGM a base de plomo sin mantenimiento, con un tiempo de carga de 2-4 h. El peso neto es de 14 kg (sin baterías) y el bruto de 18 kg. Las dimensiones son 450x380x87 mm (19”x380x2U) y el embalaje es de 540x490x190', metadata={'nombre_pdf': 'riello-sentinelrack', 'modelo': 'Sentinel Rack', 'proveedor': 'RIELLO', 'equipo': 'sai', 'tabla': True}), Document(page_content='[TABLA] Modelo Sentinel Rack de RIELLO: Este modelo de SAI está diseñado para aplicaciones críticas. Su capacidad de potencia varía entre 1.5 kVA y 10 kVA. Utiliza tecnología On-line doble conversión, garantizando una protección eléctrica máxima. Incorpora un factor de potencia de salida de 0.9, lo', metadata={'nombre_pdf': 'riello-sentinelrack', 'modelo': 'Sentinel Rack', 'proveedor': 'RIELLO', 'equipo': 'sai', 'tabla': True}), Document(page_content='amplio rango de tolerancia de tensión de entrada ayuda a reducir el uso de la batería y a mantener las prestaciones a lo largo del tiempo. EXPANSIBILIDAD DEL TIEMPO DE FUNCIONAMIENTO (SER 3000) Se pueden conectar módulos de extensión de batería para aumentar el tiempo de funcionamiento del SAI. La', metadata={'nombre_pdf': 'riello-sentinelrack', 'modelo': 'Sentinel Rack', 'proveedor': 'RIELLO', 'equipo': 'sai'}), Document(page_content='del sistema. [LISTA] Diseño de doble entrada, que permite diferentes fuentes de suministro de energía para una mayor disponibilidad. [LISTA] Bypass manual incorporado para garantizar energía continua a la carga, incluso si el UPS falla ó se encuentra en labores de mantenimiento. Costo total de', metadata={'nombre_pdf': 'delta-sai', 'modelo': 'SAI de 20kVA', 'proveedor': 'Delta', 'equipo': 'sai'}), Document(page_content='HIGHLIGHTS [LISTA] Factor de potencia 0.9 [LISTA] Funcionamiento flexible [LISTA] Función de emergencia [LISTA] Optimización de batería [LISTA] Expansibilidad del tiempo de funcionamiento [LISTA] Diseño compacto [LISTA] Profundidad del rack de 380 mm Sentinel Rack DIGITAL LIVING E-MEDICAL EMERGENCY', metadata={'nombre_pdf': 'riello-sentinelrack', 'modelo': 'Sentinel Rack', 'proveedor': 'RIELLO', 'equipo': 'sai'}), Document(page_content='atmosféricas [LISTA] Alta capacidad de sobrecarga (hasta 150%) [LISTA] Auto restart programable al restablecerse la red [LISTA] Activación por batería (Cold Start) [LISTA] Corrección del factor de potencia (factor de potencia de entrada del SAI, aprox. 1) [LISTA] Amplio rango de tolerancia de', metadata={'nombre_pdf': 'riello-sentinelrack', 'modelo': 'Sentinel Rack', 'proveedor': 'RIELLO', 'equipo': 'sai'})]"
